Name_lang,Description_lang,Map[0],Map[1],ID,JournalInstanceID,DungeonEncounterID,OrderIndex,FirstSectionID,UiMapID,MapDisplayConditionID,Flags,DifficultyMask
督军拉姆塔斯,作为剃刀大军的指挥官，督军拉姆塔斯是一头魁梧的老野猪人。在与半人马、鹰身人、兽人甚至牛头人的多年战斗中，他厚实的外皮上留下了数不清的伤疤。在他的迟暮之年，拉姆塔斯又感受到了野猪人精神领袖，阿格姆和亡语者贾格巴来自灵魂国度的指引。,0.574939,0.305955,899,234,1659,3,8660,301,0,0,-1
盲眼猎手格罗亚特,在沉寂多年后，一只巨大的怪物从黑暗的洞穴深处现出了真身。这头巨大的蝙蝠一直靠一头曾经被称为暴怒的阿迦赛罗斯的野猪提供食物，而他的粪便则为这头野猪提供了强大的黑暗力量。,0.0893967,0.548399,900,234,1660,4,8671,301,0,0,-1
卡尔加·刺肋,卡尔加·刺肋是剃刀部族的“领袖”（或者说“主母”），她在地卜术方面的造诣无人能及。她的迅速崛起和野猪人部族之间无休止的暴力冲突最终只会导致一个结局：战争。,0.219597,0.311669,901,234,1661,5,8682,301,0,0,-1
黑手,作为黑石氏族的督军，黑手是个好勇斗狠的战士，也是个残酷无情的暴君。他在钢铁部落是仅次于格罗玛什的存在。经受着常人难以忍受的酷热高温，黑手坐镇在他的熔炉顶上统管整座铸造厂，挥舞他那覆满炽热炉渣的战锤打造出一把把神兵利器。,0.484914,0.345488,959,457,1704,10,9560,600,0,0,-1
兰吉特,兰吉特花费了毕生心血来提高他的飞轮技巧。当他对这项传统鸦人武器的运用达到炉火纯青的地步时，他甚至能将风塑形，并用来对付敌人。他现在正把守着通往通天峰内部圣殿的入口处，并愿誓死捍卫鸦人在通天峰至高无上的权威。,0.63344,0.385852,965,476,1698,1,9260,601,0,0,-1
阿拉卡纳斯,通天峰上的高等鸦人曾仔细观察过德莱尼文明，他们对那些用来保护城市和圣殿的强大构造体产生了浓厚兴趣。鸦人开始筹划并建造类似的版本，一台由阳光驱动的，拥有毁灭力量且绝对服从的——强能构装体。,0.524116,0.612541,966,476,1699,2,9264,601,0,0,-1
鲁克兰,这只看上去雄壮威严的火鹰，谣传曾是鸦人敬奉的太阳神——鲁克玛的子嗣，太阳的光芒照射在阿兰卡峰林的大地上。鲁克兰对日光能量有着与生俱来的自然亲和，它能吸收并利用太阳的能量，将所有猎物烧成灰烬。,0.427653,0.819936,967,476,1700,3,9268,601,0,0,-1
高阶贤者维里克斯,为了执行鲁克玛的意志，高阶贤者维里克斯甘愿放弃一切来试图驾驭埃匹希斯神器的力量。最终，成型的大规模水晶超级武器聚集了太阳能量消灭了敌人，现在是时候重申鸦人在德拉诺应有的统治地位了。,0.511254,0.27492,968,476,1701,4,9272,602,0,0,-1
屠夫,这个食人魔出生于悬槌堡下恶臭的屠宰场，他或许曾有过自己的名字，但早已被人淡忘。早年的酷虐与折磨已让他失去了心智，但却使其体格得到了高度强化。现在悬槌堡没有一个食人魔敢靠得他太近，因为他的骨锯所到之处可谓血肉横飞，尸横遍野。,0.578492,0.55068,971,477,1706,2,9288,610,0,0,-1
兽王达玛克,作为一名年轻的兽人，达玛克以天才驯兽师的身份在雷神氏族中迅速蹿升。当其他人只着眼于野兽的本能时，他还看到了它们的智慧，并引导它们发挥出大脑、肌肉和骨骼中从未被开发的潜力。当钢铁部落要求他效劳时，达玛克将提供和训练全德拉诺最凶猛的野兽视为莫大的荣誉。,0.663082,0.721774,1122,457,1694,3,9294,599,0,0,-1
缚火者卡格拉兹,在钢铁部落的大旗之下，黑手征召了火刃氏族的缚火者卡格拉兹来为黑石铸造的武器灌注火焰之力。卡格拉兹与她的助手艾克诺·钢铁使者正在一座永不熄灭的熔炉前孜孜不倦地工作着，为钢铁部落征服德拉诺提供支援。,0.19534,0.768817,1123,457,1689,5,9336,596,0,0,-1
卡加斯·刃拳,卡加斯·刃拳是碎手氏族的督军，他曾作为奴隶，在食人魔的角斗比赛中磨练出了凶猛的战斗技巧。他为了一个虚无缥缈的自由承诺杀死了无数对手，却在获胜后和其他退役的“勇士”一起被关了起来。在怒火的推动下，卡加斯斩断了自己的手逃出生天，并领导了一场让德拉诺的食人魔血流成河的大战。现在，他已经迫不及待地返回竞技场，让你见识下野蛮的真谛。,0.547589,0.576638,1128,477,1721,1,9377,612,0,0,-1
啸天者托瓦拉,在钢铁部落崛起之前，托瓦拉还未从未涉足过霜火岭那个冰冻苔原以外的地方。她在霜火岭带领着大批雷神氏族追踪者去诱捕并俘获德拉诺最为凶猛的双头飞龙。托瓦拉对双头飞龙的驾驭能力无人能出其右，而现在的她也被钢铁部落任命为空军指挥官。,0.0864959,0.510542,1133,536,1736,3,9409,609,0,0,-1
箭火和波尔卡,铁路主管保利·箭火是恐轨车站的首席监工。他受加尔鲁什·地狱咆哮的雇佣，来为钢铁部落的基础建设建立必要的技术体系。在负责搬搬抬抬的笨蛋助手波尔卡的帮助下，箭火已经开始建设恐轨车站。,0.713855,0.578313,1138,536,1715,1,9426,606,0,0,-1
莎达娜·血怒,莎达娜·血怒是影月氏族中一名非常强大的侍僧，与月运周期有着非常紧密的联系。当黑暗之星的低语飘荡在影月谷的中心地带时，莎达娜便追随她的酋长耐奥祖深入氏族的墓地，运用她的力量将灵魂从尸体中剥离出来，用来实现某种扭曲的意图。,0.522427,0.510554,1139,537,1677,1,9460,574,0,0,-1
骨喉,食腐蛆虫骨喉蛰伏在影月谷地底深处的洞穴里，它和耐奥祖的追随者们保持着一种微妙的共生关系：骨喉以影月教派黑暗仪式上那些被牺牲的祭品，作为回报它会效忠于耐奥祖，替他把守通往内部神殿的道路。,0.398417,0.514512,1140,537,1679,3,9461,575,0,0,-1
寒冰之王亚门纳尔,巫妖亚门纳尔曾是天灾军团的一员，在第三次大战中参与了对海加尔山的突袭。之后，巫妖王命令他的仆从留在卡利姆多，负责扩大天灾军团的影响力。但这次行动被部落和联盟的英雄挫败了。现在，剃刀高地的相对和平又受到了威胁。亡语者布莱克松想要复活这个强大的巫妖并重新发起对贫瘠之地的进攻。,0.45509,0.582335,1141,233,1666,5,9484,300,0,0,-1
阿鲁克斯,亡首教派的魔灵师对自己的成果非常骄傲。经过无数次失败的尝试后，他们终于为亡语者布莱克松创造出了合适的护卫。阿鲁克斯是一只巨型蜘蛛，它的身躯长满剧毒的脓疱，爆裂后能溅出可怕的毒液。现在，魔灵师们正在等待机会展示他们的造物。,0.58982,0.342815,1142,233,1662,1,9491,300,0,0,-1
麦什伦,亡语者布莱克松最新的造物麦什伦是用其他失败的造物部件拼合而成的怪物。它体内充满了胆汁、脓水和其他毒液，将通往亡语者布莱克松的大厅都彻底污染了。,0.34531,0.664671,1143,233,1664,3,9496,300,0,0,-1
刽子手戈尔,随着阿库麦尔的力量增长，它所需的祭品也在不断增多。而刽子手戈尔最擅长的就是杀害尖叫着的无辜者。暮光之锤很好地利用了他的长处。,0,0,1144,227,1670,6,9515,319,0,0,-1
苏克,苏克拥有许多对暮光之锤来说有十分宝贵的优良品质，但其中绝对不包括智慧。由于深信屠杀深渊守护者能够为他带来大量黄金，苏克的小脑瓜已经没空去考虑其他事情。任何打断他工作的人都会被他活剐了。,0,0,1145,227,1675,4,9518,319,0,0,-1
亡语者布莱克松,在寒冰之王亚门纳尔被击败后，亡语者布莱克松在亡首教派内迅速蹿升。在夺得教派的绝对控制权后不久，布莱克松开始聆听到黑暗低语。这些低语承诺，如果他能令亚门纳尔重返世间，就会得到惊人的力量与财富。受强大的非自然力量驱使，布莱克松发现了亚门纳尔的护命匣的存放处。现在，返回剃刀高地的布莱克松已经准备好完成仪式，并让他的前主人再次复活。,0.43014,0.627246,1146,233,1665,4,9523,300,0,0,-1
主管索戈尔,和一身蛮力相比，索戈尔的狡诈与残酷似乎更富盛名，他负责整个恐轨的运作。从铸造厂车站开始，他就协调指挥与塔拉多德莱尼的持续地面作战，背后更是有整队随叫随到的作战部队以及炮火支援。,0.461397,0.220352,1147,457,1692,6,9530,599,0,0,-1
独眼魔双子,普尔和费莫斯是元首马尔高克的贴身侍卫，他们俩把守着悬槌堡之巅通往迦台农神殿的大门。这对食人魔兄弟虽然在智力上有所欠缺，但他们的力量和意志绝对是出类拔萃的，他们的块头和凶残程度也是无与伦比的。,0.551049,0.36377,1148,477,1719,5,9586,613,0,0,-1
克拉戈,在纳格兰悬槌堡的一次挖掘行动中，克拉戈是唯一一个直接暴露在神秘遗物下还能生还的幸存者，而这次经历使得他近乎免疫一切魔法。谣传他和悬槌堡的统治者有着说不清道不明的关系，但令人不解的是，拥有如此天赋的他为何还要在那位并不待见的巫师面前卑躬屈膝。,0.378245,0.654512,1153,477,1723,6,9631,613,0,0,-1
爆裂熔炉,黑石氏族的传世技艺便是熔炼黑石矿石，这是一种高密度的矿石，一般的烈焰甚至不能将其软化。黑石氏族世世代代守护着他们的独门秘籍。在铸造厂深处，他们的熔炉所蕴含的原始力量甚至和德拉诺的历史一样久远，被禁锢在其中的狂暴之力散发出令人难以置信的极热。,0.459677,0.534946,1154,457,1690,7,9636,597,0,0,-1
汉斯加尔与弗兰佐克,汉斯加尔与弗兰佐克这对双胞胎兄弟从小就被培养成氏族的格斗大师。两人都踏上了追求氏族勇士的光荣道路，但命运却跟他们开了个玩笑。由于兄弟二人都不愿意在决斗中杀死对方，结果被双双逐出氏族，任其自生自灭。但他们在德拉诺的野蛮荒原上活了下来。当钢铁部落发出召唤时，这两位强大的战士又在这架庞大的战争机器里找到了新的位置。,0.474015,0.767473,1155,457,1693,2,9843,596,0,0,-1
耐奥祖,耐奥祖是影月氏族的酋长和萨满长者，他将整个部族的灵与肉都奉献出来，只为能加入钢铁部落。他现在隐退至氏族的远古墓地，并企图在黑暗的道路上越走越远，全身心地投入到无尽虚空和通灵邪术的怀抱中去。,0.48285,0.470977,1160,537,1682,4,9677,576,0,0,-1
格鲁尔,加尔鲁什知道驯服戈隆的关键就在于降服他们的族长，格鲁尔。在另一个时空中大名鼎鼎的屠龙者如今已被贬为卑贱的工人。更加讽刺的是，他们还按照碎手氏族战士的传统，砍掉了他的一只手并装上铁钩，以便他能更轻松地将一盘盘燃料倒入熔炉。,0.393369,0.205645,1161,457,1691,4,9681,597,0,0,-1
克罗莫格,玛戈隆是种迷一样的生物，古老而又神秘。为了满足钢铁部落大型造物的生产需要，矿工们夜以继日地在铸造厂进行挖掘开采工作。他们后来被一头蛰伏在密室里的玛戈隆给吓呆了，竟然还是活着的。但令他们感到惊讶的是，克罗莫格开始帮他们出力，用他那硕大的石拳锤炼出巨型铁板，为钢铁部落巨兽般的攻城机械提供原材料。,0.332437,0.431451,1162,457,1713,8,9692,596,0,0,-1
尼托格·雷塔,对于加尔鲁什引入德拉诺的全机械化重装部队而言，对火焰和爆炸有着极度狂热的尼托格可谓是指挥这支部队的不二人选。因此，他在钢铁部落内部蹿升得非常快。他负责管理整列恐轨号的火控系统，一心想要击溃沙塔斯的外围防御圈，并将那些试图对抗钢铁部落的敌人一网打尽。,0.650602,0.510542,1163,536,1732,2,9707,609,0,0,-1
纳利什,耐奥祖在影月氏族的古老墓地进行着某种黑暗仪式，将现实世界撕开一个裂口，并任由虚空能量的溢出。食魂者纳利什正是通过这条裂隙进入到现实世界，并寻找可以吞噬的灵魂。纳利什由纯粹的黑暗能量所构成，渴望搜集并吞噬一切活物。,0.788918,0.736148,1168,537,1688,2,9759,574,0,0,-1
警戒者凯萨尔,那些最最伟大的德莱尼勇士在其生命临近结束时，往往会响应最终的召唤：将自己封印在那些重装构造体中，作为奥金顿永恒的守护者来捍卫德拉诺的德莱尼文明。这些特殊的警戒者被委以守护剩余水晶的职责，而正是这些水晶在为奥金顿提供坚不可摧的能量护盾。,0.289222,0.336398,1185,547,1686,1,9823,593,0,0,-1
缚魂者尼娅米,尼娅米是一名德莱尼女祭司，表面上她是深受信任的慰魂者，可以自由进出奥金顿内最为神圣的区域。但实际上她是暗影议会的人，此刻的她正密谋策划关掉保护陵墓免遭侵犯的神圣护盾。,0.49898,0.679591,1186,547,1685,2,9830,593,0,0,-1
泰克图斯,作为形成德拉诺大地的混乱之力的远古化身，泰克图斯被疯狂的白鬼兽人扭曲并奴役了——但就算是他们，也只能勉强驾驭这股自然的伟力。,0.37021,0.748455,1195,477,1722,3,10055,610,0,0,-1
布兰肯斯波,布兰肯斯波是远古时代的深渊行者，钢铁部落停泊在悬槌堡附近水域的钢铁战蝎引起了他的注意。这位水栖巨人会在所到之处留下蔓延的真菌和苔藓，而原始本能则驱使他泯灭出现在德拉诺的任何文明的痕迹。,0.508653,0.164401,1196,477,1720,4,9976,610,0,0,-1
元首马尔高克,作为悬槌堡至高无上的统治者，元首马尔高克出身于一个世代统治高里亚帝国的巫师家族。生性残忍且狡猾奸诈的马尔高克意识到钢铁部落的崛起，以及与之对抗的下场。所以他默允了与格罗玛什的同盟关系，即便如此他仍在寻找一个平衡点，从而使胜利的天平倾向于他这方。,0.453028,0.752163,1197,477,1705,7,9956,615,0,0,-1
奥尔高格,黑石铸造厂的仓库囤积了大量未经加工处理的黑石矿石，这对那些从地下钻进来的贪婪的鬣蜥人来说，可谓是一场饕餮盛宴了。奥尔高格是迄今为止块头最大的入侵者，贪婪且嗜石成性的他俨然已成为德拉诺有史以来体型最为庞大的鬣蜥人了。,0.371864,0.823924,1202,457,1696,1,9960,597,0,0,-1
钢铁女武神,在兽人的古老社会结构下，加安几乎没有机会发挥她的战术天赋。因此，作为第一批战士志愿加入钢铁部落海军时，她的心情异常激动。她在战斗中迅速大放异彩，被任命为钢铁部落舰队的海军上将，并选择了玛拉卡和苏卡作为她的副官。她们三人被称为钢铁女武神——并横扫了所有敢于在战斗中直面她们的人。,0.823477,0.283602,1203,457,1695,9,10006,596,0,0,-1
远古的保卫者,高拉和特鲁是一对护林木精，他们以极快的速度在林地里生长蔓延，试图夺回他俩之间那座命运多舛的岗哨。负责保护他们完成此项任务的人便是恐怖屠夫杜尔胡，许久以前他曾是个黑石兽人，独自在原始林地的深处游荡，而现在的他更像是植物多一点了。,0.656984,0.233003,1207,556,1757,2,10405,620,0,0,-1
大法师索尔,大法师索尔原本是坚守在紫罗兰断崖处的肯瑞托远征军中的一员，但最终还是被孢子侵占了她的大脑。或许在她内心深处仍然残留着部分人性，但现在的她只是一个被禁锢在自身躯壳里的囚徒。,0.558096,0.359085,1208,556,1751,3,10472,620,0,0,-1
艾里塔克,这只恶毒的蛛后守护着自己的蛛卵，她的巢穴位于戈尔隆德的地底深处。她正等待那些愚蠢的猎物送上门来，被其诱捕并吞噬。,0.597651,0.123883,1209,556,1752,4,10496,620,0,2,3
雅努,原祖荆兽雅努古老而又神秘，它被紫罗兰断崖散发出来的奇异能量所吸引，该处是肯瑞托位于戈尔隆德的一个前哨站。长久以来，原祖荆兽和它们永恒的对手——玛戈隆（戈隆的一种，岩石之子）在德拉诺的对抗正陷入胶着。但雅努仿佛看到了一个全新的世界，通过这些奇异能量可以让它的族群繁荣兴旺、生生不息。,0.4501,0.821857,1210,556,1756,5,10548,621,0,0,-1
永恒的塔尔纳,据说在塔尔纳抵达戈尔隆德之前，这里曾是贫瘠的不毛之地；据说原祖荆兽所到之处遍地花开，绿意盎然；据说这个家伙是不朽的，就像遭遇过山火的森林一样会重新恢复原貌。有关塔尔纳的传言有很多，但很少是被证实或亲眼目睹过的。,0.47006,0.859282,1211,557,0,2,10670,543,0,0,-1
枯木,在戈尔隆德繁茂的密林深处，枯木已经经历了不计其数的花开花落，生死轮回。这些个自命不凡的“钢铁部落”和奇怪物种以为是他们的天下了。可对枯木来说，他们只不过是昙花一现，早晚会成为过眼云烟，唯有枯木才会永恒。,0.530948,0.564895,1214,556,1746,1,10090,620,0,0,-1
阿扎凯尔,在德莱尼曾经的故乡、燃烧军团如今的堡垒阿古斯，阿扎凯尔在等待着，随时准备作为燃烧军团的仆人，为它们打开一扇扇通往要想征服的异世界的传送门。当缚魂者尼娅米削弱奥金顿的防御时，阿扎凯尔感到时机来临了。,0.707832,0.332832,1216,547,1678,3,10102,593,0,0,-1
塔隆戈尔,古尔丹的密探塔隆戈尔与萨格雷合谋，妄图吞噬在奥金顿神圣陵墓中安息的万千亡魂。,0.496988,0.335799,1225,547,1714,4,10160,593,0,0,-1
折铁者高尔山,作为一个强大的元素师，高尔山天生就有通过金属来塑造并引导能量的能力。他也因此充当了钢铁部落首次入侵艾泽拉斯的急先锋。他试图通过揭示藏在黑石塔中的，由黑铁矮人制造的上古符文中的秘密来强化自身，并静待下一步的指令。,0.305389,0.267964,1226,559,1761,1,10238,617,0,0,-1
奇拉克,作为幸存的奈法利安余孽，奇拉克为免于一死，向钢铁部落提出会想尽一切办法保存并巩固黑石塔孵化间内所剩无几的黑龙军团龙蛋。钢铁部落的使者当即与这头狡诈的黑龙达成协议。,0.39022,0.387725,1227,559,1758,2,10255,617,0,0,-1
指挥官萨贝克,作为一名诡计多端的战歌氏族勇士，萨贝克被委以率领铁军远征队穿越黑暗之门发动突袭的重任。在加尔鲁什的授意下，他一路打到了黑石兽人在艾泽拉斯的老巢，并在那里集结兵力准备下一阶段的部署。,0.48503,0.24551,1228,559,1759,3,10271,618,0,0,-1
狂野的怒翼,怒翼是由暮光高地的龙喉氏族驯养的巨型始祖龙。虽然她与督军扎伊拉建立了亲密的伙伴关系并跟随其来到了黑石塔，盘踞在洞穴大厅里，但她坚强不屈的意志使其心智得以保全，没有沦为失去自我意识的坐骑。,0.46008,0.462575,1229,559,1760,4,10285,618,0,0,-1
督军扎伊拉,当加尔鲁什命令铁军先锋部队赶赴艾泽拉斯执行任务时，他就曾告诫他们与那边的“昔日盟友”会合。这位盟友就是渴望复仇、凶狠残暴却又忠心耿耿的扎伊拉，龙喉氏族的督军。现如今，她已在黑石山的中心地带组装好灭世武器，复仇的时刻即将到来。,0.1507,0.48503,1234,559,1762,5,10307,618,0,0,-1
血肉撕裂者诺格加尔,这位好勇斗狠的战歌领军在钢铁部落蹿升得很快，平步青云的他现在甚至统领了一整编的兽人部队。他骑在令人恐惧的座狼——惧牙身上厉兵秣马，似乎已经准备好对沙塔斯发动海面进攻。,0.478915,0.341868,1235,558,1749,1,10432,595,0,0,-1
恐轨押运员,恐轨押运员是一群精英佣兵，他们受雇于黑索公司，负责保护穿行在戈尔隆德的火车。这个三人小组包括一名火刃剑圣，一名地精工程师和一个使用黑血魔法的萨满。这些利欲熏心的家伙眼里只有一个信条，那就是对金钱的贪婪和杀戮的狂热。,0.802239,0.753012,1236,558,1748,2,10445,595,0,0,-1
奥舍尔,刃牙虎人奥舍尔本是徘徊在阿兰卡峰林的一个凶狠残暴的捕食者，狂妄自大终于使他栽了跟头，被雷神氏族诱捕并押至戈尔隆德接受驯化，最终沦为了钢铁部落的马前卒。奥舍尔已不止一天设想过要痛饮将其捕获者的鲜血。,0.804217,0.174969,1237,558,1750,3,10462,595,0,0,-1
斯古洛克,钢铁部落在戈尔隆德降服巨人的计划执行得非常成功，强大的戈隆斯古洛克就是最好的证明。他在格罗姆卡军中鹤立鸡群，双肩还扛着一对巨炮，形容他是走在陆地上的铁甲舰一点都不为过。斯古洛克已准备好执行新主人的命令，将目标夷为平地。,0.684696,0.436676,1238,558,1754,4,10423,595,0,0,-1
鲁克玛,鲁克玛偶尔会以一只炽燃火鹰的形象出现在阿兰卡峰林的上空。尽管鲁克玛被鸦人们看作是太阳的化身而被奉若神明，但没有人知道这只大鸟究竟从何而来。,0.471061,0.784568,1262,557,0,3,10508,542,0,0,-1
毁灭者多弗,多弗在过去的黑石氏族被称为毁灭者，一听到这名号，人们就会不由自主地与这个可怕的玛戈隆保持安全距离。多弗走到哪儿都是地动山摇，仿佛大地看到他也为之颤抖，并为其开路。,0.441283,0.399207,1291,557,0,1,10659,543,0,0,-1
血魔,落入神圣陵墓奥金顿核心的暗影议会副官塔隆戈尔吞噬了上百个德莱尼的灵魂，变成了一头臃肿的畸形怪物。如今塔隆戈尔的外表早已无法再被称为兽人，他已抛弃旧名，给自己起了一个新名字：血魔。,0.176143,0.451792,1372,669,1783,6,11006,662,0,0,-1
邪能领主扎昆,邪能领主被燃烧军团中的部分学者视为普通恶魔卫士的进化版，直接听命于阿克蒙德。他们的残酷天性与野蛮力量交相辉印。而扎昆的任务正需要他同时发挥这两项才能：击溃战歌氏族顽固而傲慢的兽人酋长的钢铁意志……,0.498764,0.182942,1391,669,1777,9,11091,666,0,0,-1
考莫克,与德拉诺一样古老的考莫克曾是戈尔隆德的统治者，这只巨型玛戈隆毁灭性的怒火足以令这片土地上的生物退避三舍。但在钢铁部落到来之后，就捉住了这只巨兽并试图打垮他的意志。他们完全失败了……直到古尔丹执掌大权时——考莫克完全无法抵抗邪能的力量。,0.52225,0.451792,1392,669,1787,3,11110,664,0,0,-1
暴君维哈里,在古尔丹带来送给萨格雷的“礼物”后，维哈里就表现出了极大的野心，并在组织中迅速蹿升。被敌人称为“暴君”的她是最先接受邪能之触的萨格雷之一，这进一步强化了她的战斗力。如今，维哈里身负着嘲弄纳鲁的圣徽，以表达她对新教派的坚定信仰。,0.293572,0.514833,1394,669,1784,11,11145,668,0,0,-1
玛诺洛斯,嗜血而野蛮的玛诺洛斯一直是阿克蒙德最恐怖的手下。即使在被格罗玛什奋力斩杀之后，他的鲜血还被古尔丹当成了收买钢铁部落及其盟友的筹码。现在，古尔丹和他的爪牙正想方设法复活玛诺洛斯支离破碎的尸骨，好让他继续为燃烧军团效力。,0.510777,0.480125,1395,669,1795,12,11193,669,0,0,-1
基尔罗格·死眼,血环氏族督军基尔罗格·死眼在经历过预见自身死亡的仪式后就掌握了自己的氏族。在认清自己的命运后，他无所畏惧地带领着氏族历经无数战役，向着他所渴望的荣耀之死进发。现在，血管中流淌着恶魔之血的基尔罗格正在地狱火堡垒中等着你，准备迎接自己——或者你的末日。,0.512361,0.334981,1396,669,1786,5,11254,665,0,0,-1
钢铁掠夺者,在奥格瑞玛陷落之后，人们在黑索本人的工作室里发现了钢铁掠夺者的图纸。它的灵感来自燃烧军团强大的构造体，是这个邪恶地精的杰作。在他死后，这个项目才真正完工，并成为钢铁部落军事力量的巅峰之作。,0.433674,0.50574,1425,669,1785,2,11389,661,0,0,-1
奇袭地狱火,在黑索公司的佣兵帮助下，钢铁部落在地狱火堡垒的脚下建造了毁灭性的攻城器械，并计划在总攻艾泽拉斯的主城时使用它们。在将坦克改装为使用邪能之后，攻城大师玛塔克只等古尔丹一声令下，就能发动攻击。,0.609695,0.450255,1426,669,1778,1,11401,661,0,0,-1
永恒者索克雷萨,德莱尼最伟大的战士会将自己的灵魂灌入闪闪发光的构装体，成为永远保护人民的警戒者。索克雷萨在堕入黑暗之前曾是主教议会的一员，他改造了这个神圣的仪式，试图在塔拉多的惨败之后，用一具扭曲的邪能构装体保存自己的灵魂。,0.595179,0.529666,1427,669,1794,8,11442,668,0,0,-1
高阶地狱火议会,数千名钢铁部落的兽人喝下了玛诺洛斯的鲜血，但只有很少数能像这三位勇士一样变得如此强大。作为虚空魔法的大师，影月氏族的流亡者，迪亚·暗语迅速展露头角，成为古尔丹的左膀右臂。古尔图格是一个永不满足的嗜血屠夫，身经百战未尝一败，只有剑圣朱倍尔索斯曾与他战成过平手。在被邪能腐蚀后，他们成为了古尔丹的亲卫和战争议会成员。,0.717552,0.676143,1432,669,1798,4,11538,665,0,0,-1
