Name_lang,Description_lang,Map[0],Map[1],ID,JournalInstanceID,DungeonEncounterID,OrderIndex,FirstSectionID,UiMapID,MapDisplayConditionID,Flags,DifficultyMask
格拉布托克,只是一阵心血来潮，格拉布托克就释放出强大的魔法力量，把他的食人魔山给夷为了平地。听到这个消息，迪菲亚立刻雇佣了这只硕大的食人魔法师作为死亡矿井的工头，借助他毁灭性的天赋来监督那些劳工。,0.3652697,0.6122755,89,63,1064,1,2010,291,0,0,-1
赫利克斯·破甲,赫利克斯从前是锈水财阀的工匠，可之后他收到了迪菲亚兄弟会的一笔款项，足以让他那样的无名部落工程师所做的一切都一文不值。就像所有精明的地精会做的那样，他迅速接下了这份工作，声称不再对前任雇主效忠。,0.50199604,0.8682636,90,63,1065,2,2020,291,0,0,-1
死神5000,迪菲亚的工程师们在死神4000的基础上，日以继夜地想要完善出一种新型号的收割机。兄弟会相信，只要完工，这台恐怖的机械就能像割麦子一样从暴风城的武装士兵中杀出一条路来。,0.12475067,0.75898206,91,63,1063,3,3448,292,0,0,-1
撕心狼将军,詹姆斯·哈林顿身中狼人的诅咒后，在一个刺骨的寒夜里毁掉了钟爱的家庭和他的远洋航海生涯。在那之后，他改名为撕心狼，逃到了西部荒野，之后更是接受了任命，指挥迪菲亚兄弟会可怖的无畏舰。,0.60479087,0.38772452,92,63,1062,4,2044,292,0,0,-1
“船长”曲奇,随着迪菲亚兄弟会前任无畏舰指挥官的死亡，曲奇自封为船长。尽管他在主厨的工作上仍然尽职尽责，但若是有谁质疑其船长的头衔来得是否光明磊落，那人就会因为严重的食物中毒而倒地不起。,0.60479087,0.4550898,93,63,1060,5,2055,292,0,0,-1
梵妮莎·范克里夫,当梵妮莎还是一个小女孩的时候，她亲眼目睹了父亲艾德温·范克里夫的悲惨下场。作为前任迪菲亚兄弟会领袖之女，她接过父亲领袖的衣钵，在迪菲亚兄弟会据点死亡矿井的黑暗回廊里厉兵秣马，谋划着对暴风城的复仇。,0.6546913,0.40269458,95,63,1081,6,2060,292,0,2,14
灰葬男爵,灰葬男爵被狼人所杀，随后被遗忘者将其复活成亡灵。这个叛徒擅长使用暗影的力量，将他的敌人玩弄于鼓掌之间。,0.66467136,0.732036,96,64,1069,1,2107,310,0,0,-1
席瓦莱恩男爵,在这座城堡尚未落入阿鲁高狼人之手的时候，席瓦莱恩男爵是这里的主人。现在他被诅咒的灵魂召唤着将他杀害的狼人，惩处那些侵入其家园的来犯者。,0.30439156,0.7739521,97,64,1070,2,2118,311,0,0,-1
指挥官斯普林瓦尔,作为一名忠诚的士兵，指挥官斯普林瓦尔的鬼魂游荡在议会大厅里，用不洁之力为他的领主席瓦莱恩男爵复仇。,0.2804395,0.5973054,98,64,1071,3,2137,310,0,0,-1
沃登勋爵,高弗雷的左右手、傲慢的沃登勋爵曾发誓不惜一切代价，也要为其同胞鞠躬尽瘁。如今成了亡灵的一员，沃登依然信守诺言，用冰与毒对敌人发起猛攻。,0.5449104,0.53742516,99,64,1073,4,2156,313,0,0,-1
高弗雷勋爵,身为吉尔尼斯贵族及被遗忘者的眼线，狡猾而又多智的高弗雷勋爵擅使双枪，麾下还有大批残忍嗜血的食尸鬼。,0.6846315,0.3353293,100,64,1072,5,2164,315,0,0,-1
纳兹夏尔女士,在从蛮勇的克瓦迪尔手中夺回瓦丝琪尔的过程中，纳兹夏尔女士扮演了至关重要角色。她因此赢得了艾萨拉女王的青睐。最近，纳兹夏尔身先士卒，率军对耐普图隆发动了进攻，并成功地将这位强大的元素领主困在了海潮王座中。,0.50499004,0.21556878,101,65,1045,1,28310,323,0,0,-1
指挥官乌尔索克，腐烂王子,乌尔索克是一名邪恶的上古生物，上古之神派他来帮助纳兹夏尔女士侵略潮汐王座。乌尔索克浑身迸发着罪恶的力量，在瓦丝琪尔最深邃的海沟里指挥着无面者军团。,0.50499004,0.42514968,102,65,1044,2,28314,323,0,0,-1
蛊心魔古厄夏,在深渊裂口的英勇一战后，大地之环的萨满石语者埃鲁纳克最终还是被纳迦军队所俘获，并沦为蛊心魔古厄夏的奴隶。恐怕这只寄生的畸兽已经彻底控制了埃鲁纳克的心智、肉体，以及他那毁灭性的萨满法术。,0.67465144,0.19311368,103,65,1046,3,28322,322,0,0,-1
厄祖玛特,传说艾泽拉斯的大海出现过巨大的海怪，然而这个神话如今成了真。纳迦通过某种邪恶的手段，将海怪的宗主厄祖玛特控制在手下，用来对付耐普图隆及其追随者们。,0.3253496,0.19311368,104,65,1047,4,28318,322,0,0,-1
摧骨者罗姆欧格,作为外域食人魔中少见的“缺失的一环”，摧骨者罗姆欧格因其食人魔凶残的本性而被暮光之锤邪教所看重。他如今统领着焚烧之厅，靠折磨他人满足着自己的嗜虐欲。,0.5,0.70209587,105,66,1040,1,2356,283,0,0,-1
柯尔拉，暮光之兆,柯尔拉曾是一位功成名就的肯瑞托法师，如今她对暮光之锤忠贞不渝。她会祝福那些狂热的追随者，将虚空巨龙的精华授予他们，把他们变成凶狠的暮光龙人。,0.27045947,0.16317356,106,66,1038,2,2361,284,0,0,-1
卡尔什·断钢,巨大的龙人卡尔什·断钢在暮光铸炉日夜工作，用稀有的水银制造着武器。尽管卡尔什的作品在通常情况下都坚不可摧，可在高温下，它们就如锈铁一般脆弱。,0.47005993,0.6646707,107,66,1039,3,2371,284,0,0,-1
如花,如花和比斯巨兽的传说犹如美女与野兽、海洋与星空一般悠久而浪漫。比斯巨兽在黑石塔上被英雄们宰杀之后，如花带着四条剩下的小犬加入了暮光之锤的部队，志在惩罚那些杀害她的伴侣的生物。,0.66467136,0.8443115,108,66,1037,4,2378,284,0,0,-1
升腾者领主奥西迪斯,堕落者德希里克曾是一名强大的萨满，因为其狂热的虔诚和对暴行的嗜好，他被恩准升腾：通过一道黑暗仪式，他被注入了元素之力，变成了一头名为升腾者领主奥西迪斯的畸形生物。,0.68962157,0.50748503,109,66,1036,5,2385,284,0,0,-1
克伯鲁斯,死亡之翼奴役着巨大的旋岩虫克伯鲁斯，让它挖掘大量源质来为黑龙之王铸造新的盔甲。但是，当死亡之翼离去后，愤怒的克伯鲁斯摆脱了管束，在巨石之核里盲目地肆虐。,0.6297411,0.5973054,110,67,1056,1,2394,324,0,0,-1
岩皮,上古之神强化了死亡之翼身为大地守护者的力量，让他轻易地就使得深岩之洲的石龙为暮光之锤效忠。这些生物中最有抱负的一个就是岩皮。他会铲除任何胆敢进入巨石之核的入侵者，希望能够借此赢得死亡之翼的青睐。,0.3702597,0.44760478,111,67,1059,2,2401,324,0,0,-1
欧泽鲁克,从深岩之洲的创造之初，欧泽鲁克就一直是巨石之核的守护者。没有人知道他为什么还留在那里，但是很明显，这名守护者认为任何对死亡之翼不利的人，都是深岩之洲的威胁，应该予以消灭。,0.50499004,0.23053885,112,67,1058,3,2405,324,0,0,-1
高阶女祭司艾苏尔,尽管心智尽毁，但高阶女祭司艾苏尔仍然是少数几个能在同暮光之锤教派恐怖的主子沟通后，还能活下来的人。她将恐怖植根在低级教徒心中，好让他们在主子下令的时候，毫不犹豫地牺牲自己。,0.5748506,0.38772452,113,67,1057,4,2411,324,0,0,-1
大宰相埃尔坦,奉主人阿萨德之命，埃尔坦守护着旋云之巅，对抗任何来自地面的、胆敢侵入这个领域的人们。为了履行其职责，这名元素贵族被授予了统御闪电和风暴大军的特权。,0.5499004,0.44760478,114,68,1043,1,2419,325,0,0,-1
阿尔泰鲁斯,巨大的风暴之龙阿尔泰鲁斯不知疲倦地警戒着旋云之巅的浮空平台。风暴的能量在他体内脉动，传说他还驾驭着驱动着这座元素堡垒的气流。,0.51996017,0.8218564,115,68,1041,2,2425,325,0,0,-1
西风君王阿萨德,奥拉基尔亲自指名阿萨德作为旋云之巅的守护者。自从南风之主希亚玛特遭到尼斐塞特托维尔人的囚禁之后，这名可怕的元素相信自己只要干好这份差事，没准就能升上风之议会。,0.30039954,0.3802395,116,68,1042,3,2431,325,0,0,-1
胡辛姆将军,泰坦们曾亲自指派胡辛姆将军作为奥丹姆的守护者之一。在南风之主希亚玛特治愈了尼斐塞特托维尔人的血肉诅咒之后，胡辛姆将军发动了反叛，并最终将那名强大的空气元素囚禁了起来。,0.3752497,0.42514968,117,69,1052,1,2437,277,0,0,-1
锁喉,在尼斐塞特发动起义，反抗希亚玛特的乱战中，俾格米人奥弗在托维尔古城中大偷特偷。在他们的族人中，奥弗因为两件事而备受尊重：一是他的狡诈；还有一个是他的宠物，那条叫做锁喉的凶狠鳄鱼。,0.674651,0.724551,118,69,1054,2,2442,277,0,0,-1
高阶预言者巴林姆,高阶预言者巴林姆是尼斐塞特神圣的精神领袖。为了对抗希亚玛特，他与胡辛姆将军集结尼斐塞特人，将这名空气元素囚禁了起来。然而，某种黑暗力量依然驱使着巴林姆和他的追随者们，在奥丹姆散播着恐惧。,0.270459,0.657186,119,69,1053,3,2455,277,0,0,-1
希亚玛特,净化尼斐塞特托维尔人的血肉诅咒，让可怕的元素希亚玛特几乎耗尽了能量。正是在这个薄弱的关头，托维尔人发动了进攻，奇迹般地将希亚玛特囚禁在了他们的沙漠古城的中央。,0.4151698,0.5523952,122,69,1055,4,2474,277,0,0,-1
神殿守护者安努尔,泰坦在控制起源大厅最后的日子里，将掌握圣光所需的意志力赐予了神殿守护者安努尔。他被授命裁判那些进入神殿的人们是否纯洁。,0.5848307,0.62724555,124,70,1080,1,2489,297,0,0,-1
地怒者塔赫,地怒者塔赫墓穴外的沙地上铺满了累累白骨，他们都是被安努尔所净化的生物。据说塔赫能操纵这些遗骨，让它们去对付那些成功绕开第一道防线的入侵者。,0.5,0.49251497,125,70,1076,2,2540,298,0,0,-1
安拉斐特,安拉斐特维护单位的用途是维护起源大厅的内部运作。一旦设施遭到外来物的污染，安拉斐特将获得攻击程式的权限，不计一切代价歼灭入侵者。,0.5598805,0.14071846,126,70,1075,3,2551,297,0,0,-1
伊希斯特，魔法的造物,起源大厅所产生的奥术能量充盈在其内部，伊希斯特的职责就是对其进行调控。传说这个构造体对这一貌似是天赐的奥术掌控能力过于沉迷了。,0.31037956,0.5,127,70,1077,4,2555,299,0,0,-1
阿穆纳伊，生命的造物,尽管在设计上，起源大厅里生命重组系统的初衷，是将艾泽拉斯降解为最基本的元素结构，但它同时也能够创造新的生命。为此，结构体阿穆纳伊控制着设施内部流动的自然能量，确保生命能在重塑后的艾泽拉斯继续存在。,0.47504994,0.74700606,128,70,1074,5,2565,299,0,0,-1
塞特斯，毁灭的造物,考虑到起源大厅的用途，泰坦认为创造一个掌握毁灭力量的结构体十分必要，那就是塞特斯。要是塞特斯被腐化了，那么后果将是灾难性的。,0.63972116,0.49251497,129,70,1079,6,2666,299,0,0,-1
拉夏，太阳的造物,拉夏所监管着的能量，滋养也湮灭了他的无数同类。他是四个构造体中最强的一个，其能力可以将一千个太阳的怒火倾泻到艾泽拉斯之上。,0.47504994,0.25299394,130,70,1078,7,2926,299,0,0,-1
乌比斯将军,艾泽拉斯的勇者和他们的红龙盟军对格瑞姆巴托的大门发动了进攻，率领堡垒中教徒和暮光龙兽展开防御的，正是凶神恶煞般的乌比斯将军。,0.40518978,0.6871258,131,71,1051,1,3353,293,0,0,-1
铸炉之主索朗格斯,这名巨大的双头魔是暮光之锤教派的匠人，他热衷于用自己所铸造的武器和铠甲，消灭那些入侵者。,0.515,0.3,132,71,1050,2,816,293,0,0,-1
达加·燃影者,这名暮光之锤的信使正在执行一个来自暮光之锤的任务。如果英雄们能够征服他那些烈焰的爪牙，达加就会让艾泽拉斯的保卫者们见证一个真实的末日预言。,0.6946116,0.19311368,133,71,1048,3,3364,293,0,0,-1
地狱公爵埃鲁达克,死亡之翼派出了他最厉害的副手之一，旨在探寻强大的红龙牺牲性命也要保住的秘密。这名无面者将军来自深岩之洲的洞穴世界，任何敢于向他发起挑战的蠢货，都会被其体内融合的新生代龙族之力所消灭。,0.8562618,0.74700606,134,71,1049,4,3374,293,0,0,-1
阿尔加洛斯,由于深渊领主阿尔加洛斯过于巨大，达拉然宏伟的紫罗兰监狱都无法容下，肯瑞托的法师们别无选择，只好把这头强大的恶魔关在托尔巴拉德的地下。,0.8043925,0.6347306,139,75,1033,1,2602,282,0,2,15
欧库塔尔,这头饥饿的恶魔从牢笼中挣脱了出来，来到了监狱的西侧，吞噬了那里关押的所有囚犯。欧库塔尔的贪吃导致他的身躯臃肿，难以逃离，结果无非只是将自己困在了更大的牢狱中。,0.15568893,0.6317773,140,75,1250,2,2605,282,0,2,15
风之议会,随着南风之主希亚玛特被尼斐塞特所囚，奥拉基尔的副手们踊跃地想要填补风之议会里出现的权力真空。剩下的三名议会成员分别是：能够使用狂风治疗盟友或毒伤敌人的西风之主安舍尔，能够用风暴将最宏伟的山脉磨成齑粉的东风之主洛哈西，而葬送在北风之主尼希尔冰冷风暴之下的性命，比其他三位加起来的还要多。,0.47504994,0.26047897,154,74,1035,1,3166,328,0,2,15
奥拉基尔,借着无人能比的智慧和狡诈，风元素领主奥拉基尔曾是上古之神那支可怖军队中最出色的战略家。大灾变之后，他和死亡之翼同流合污，把神一般的力量用来对付空气元素的远古宿敌托维尔人。,0.47504994,0.5,155,74,1034,2,3021,328,0,2,15
哈尔弗斯·碎龙者,受古加尔之赐，双头魔哈尔弗斯·碎龙者具备着超自然的力量和体力，能够捕获巨龙，来让暮光之锤的仪式得以为继。为此，他奴役了一头巨型的始祖龙，来帮他进行狩猎。,0.5349303,0.19311368,156,72,1030,1,2959,294,0,2,15
瑟纳利昂和瓦里昂娜,奇迹般成年的瓦里昂娜和瑟纳利昂本该在新一代的暮光巨龙中充当典范，带着其子嗣吞噬艾泽拉斯的生命。然而，他们却总是把无与伦比的力量浪费在争斗和口角上。,0.53992033,0.7844312,157,72,1032,2,2994,294,0,2,15
升腾者议会,和大多数被转化成元素生物的强大暮光之锤邪教徒一样，升腾者议会的成员早已忘记了他们作为凡人的存在。他们在邪恶的圣堂里监管着新的升腾者候选人的选拔。,0.42514983,0.4550898,158,72,1028,3,3109,295,0,2,15
古加尔,在古加尔的控制下，暮锤氏族的兽人已经变成了一支嗜杀的邪教，盲目地崇拜着上古之神及其使者死亡之翼。因为长时间地同他那黑暗的主子接触，古加尔的身心已经遭到了异常的扭曲。,0.73453194,0.7544911,167,72,1029,4,3165,295,0,2,15
希奈丝特拉,作为死亡之翼的原配，希奈丝特拉创造了第一代暮光巨龙，却在之后被自己所诞下的可怖生物所泯灭。如今的她只是一具疮痍满布的枯骸，被恶毒的魔法所复生，监管着新一代暮光龙群的诞生。,0.49001998,0.34281433,168,72,1082,5,3226,296,0,2,12
全能金刚防御系统,全能金刚防御系统曾被标榜为黑铁矮人最伟大的技术奇迹。当奈法利安来到黑翼血环时，他修复了这个当时业已废弃的系统，并用其歼灭任何胆敢闯入他实验室的人。,0.6546913,0.5748503,169,73,1027,1,3193,285,0,2,15
熔喉,熔喉是一只巨大的岩浆虫。几个世纪前，它被拉格纳罗斯的黑铁奴仆们从火焰之地召唤出来。一开始奈法利安觉得熔喉不过是只麻烦的害虫，不过后来他养成了一个特别的习惯……用这头畜生来处理失败的试验品……,0.27544948,0.5748503,170,73,1024,2,3310,285,0,2,15
艾卓曼德斯,艾卓曼德斯，又称实验体25463-D，是企图为一只黑龙幼崽强化感知力而诞生的失败作品。剧毒的药膏夺去了他的视力，迫使他只能靠嗅觉和听觉来生存。刨去艾卓曼德斯邪恶非凡这一点来看，这还真是个悲惨的故事。,0.47504994,0.32784426,171,73,1022,3,3072,286,0,2,15
奇美隆,恐怖、丑恶、邪恶。杀了它。,0.2455094,0.70209587,172,73,1023,4,3008,286,0,2,15
马洛拉克,马洛原是一名前途无量的人类炼金师，直到奈法利安将他绑架，并把他同一具龙兽的尸体融合在一起。结果就造出了这名笨手笨脚、只有几分前世心智残存的仆从：马洛拉克。,0.7145718,0.70209587,173,73,1025,5,2929,286,0,2,15
奈法利安的末日,因为曾使用艾泽拉斯各大龙族军团的精华来创造多彩巨龙，死亡之翼之子奈法利安变得臭名昭著。在他死于黑翼之巢后，死亡之翼将他复活，并赐予其新的力量，让他继续那邪恶的计划。,0.48003995,0.70209587,174,73,1026,6,3276,286,0,2,15
高阶祭司温诺希斯,温诺希斯本来是被派去杀死哈卡的，可他却被那凶残的存在所奴役，直到艾泽拉斯的英雄们完成了他的使命。在夺灵者的使徒们的努力下，温诺希斯从灵魂世界转生，受命和他的毒蛇一起守卫祖尔格拉布。,0.5099801,0.53742516,175,76,1178,1,2787,337,0,0,-1
血领主曼多基尔,恶名昭著的血领主曼多基尔多年前备受折磨而死，之后其尸体更是被血顶巨魔所亵渎。风传曼多基尔将其恶毒的灵魂寄宿在强大的血顶酋长甘祖拉恩的尸体里，血领主再一次出现在了荆棘谷的丛林中。,0.60479087,0.7994013,176,76,1179,2,2610,337,0,0,-1
疯狂之缘——格里雷克,疯狂之缘里有四名充满仇恨的灵魂：可怕的巨魔格里雷克被神剥夺了再生能力；战士雷纳塔基以热衷施虐而臭名昭著；先知哈扎拉尔整日被恐怖的未来预言所折磨；强大的战将乌苏雷则拥有号令风暴的力量。,0.599801,0.462575,177,76,788,3,2504,337,0,0,-1
疯狂之缘——哈扎拉尔,疯狂之缘里有四名充满仇恨的灵魂：可怕的巨魔格里雷克被神剥夺了再生能力；战士雷纳塔基以热衷施虐而臭名昭著；先知哈扎拉尔整日被恐怖的未来预言所折磨；强大的战将乌苏雷则拥有号令风暴的力量。,0.6367,0.462575,178,76,788,4,3508,337,0,0,-1
疯狂之缘——雷纳塔基,疯狂之缘里有四名充满仇恨的灵魂：可怕的巨魔格里雷克被神剥夺了再生能力；战士雷纳塔基以热衷施虐而臭名昭著；先知哈扎拉尔整日被恐怖的未来预言所折磨；强大的战将乌苏雷则拥有号令风暴的力量。,0.599801,0.51497,179,76,788,5,2501,337,0,0,-1
疯狂之缘——乌苏雷,疯狂之缘里有四名充满仇恨的灵魂：可怕的巨魔格里雷克被神剥夺了再生能力；战士雷纳塔基以热衷施虐而臭名昭著；先知哈扎拉尔整日被恐怖的未来预言所折磨；强大的战将乌苏雷则拥有号令风暴的力量。,0.601905,0.414711,180,76,788,6,2498,337,0,0,-1
高阶祭司基尔娜拉,高阶祭司娅尔罗被杀之后，豹神贝瑟克选择她的妹妹基尔娜拉作为其新的凡间代表。为了支持最近古拉巴什和赞达拉部落达成的协议，基尔娜拉放出了她凶残的猎豹，来对付这里不设防的住民。,0.48003995,0.20059872,181,76,1180,7,2692,337,0,0,-1
赞吉尔,因为把同胞变成了丧失心智的奴隶，赞吉尔一度被劈颅部落所放逐。为了壮大祖尔格拉布的军队，碎神者金度让他在古拉巴什中任职。众所周知，起死回生这种事，对他的药剂来说一点都不难。,0.31733844,0.24550891,184,76,1181,8,2508,337,0,0,-1
碎神者金度,在祖尔格拉布被打败之后，金度的灵魂因为没能满足哈卡的愿望而饱受折磨。但最近，他通过某种办法回到了现世，并奴役了夺灵者。带着恐怖神灵的可怕力量，金度誓要恢复古拉巴什帝国往日的辉煌。,0.48502997,0.39520955,185,76,1182,9,2899,337,0,0,-1
埃基尔松,作为阿曼尼部落曾经的萨满，埃基尔松驾驭空气元素的本领令人赞赏。他的天赋被妖术领主玛拉卡斯所看中，这也让巨魔们的鹰神没费太大力气就找到了合适的宿主。,0.35528967,0.23053885,186,77,1189,1,2521,333,0,0,-1
纳洛拉克,纳洛拉克在战场上以其可怕的怒火和野蛮的力量而著称，妖术领主玛拉卡斯认为他是承载熊神精华的理想容器。,0.40518978,0.7739929,187,77,1190,2,2867,333,0,0,-1
加亚莱,龙鹰是敏捷的猛禽，其利爪可以轻易地撕碎敌人。阿曼尼部族也有这样一只训练有素的野兽，它就是加亚莱。,0.55489045,0.7095809,188,77,1191,3,2621,333,0,0,-1
哈尔拉兹,艾泽拉斯的山猫是凶猛的猎手，拥有能够撕碎猎物的利爪和利齿。受启发的妖术领主玛拉卡斯觉得，在部族最厉害的猎手里挑一名，把山猫之神的精华封在里面，应该很合适。,0.5848307,0.23802388,189,77,1192,4,2804,333,0,0,-1
妖术领主玛拉卡斯,数十年来，妖术领主玛拉卡斯都被说成是阿曼尼部族里最可怕的巫医。他的所作所为令人难以想象，还将数名强大的巨魔动物神灵的精华封存在部族最强壮的战士体内……而他也把最为黑暗的一只寄宿在了自己身上。,0.7145718,0.5299401,190,77,1193,5,2706,333,0,0,-1
达卡拉,为了弥补督军祖尔金死后所形成的权力真空，阿曼尼部族余下的巨魔们推举他们最喜爱的常胜将军：战无不胜的达卡拉来恢复他们失落的荣光。,0.90419334,0.5299401,191,77,1194,6,2875,333,0,0,-1
贝丝缇拉克,作为烬网蜘蛛的蛛母，贝丝缇拉克和她无情的后代们靠吮吸火元素残骸上的岩浆和火焰来满足他们的食欲。为了给她的子嗣们提供更多的养分，贝丝缇拉克在她的巢穴周围编织了一张巨大的火网，用来诱捕误入其中的猎物。,0.21057922,0.32784426,192,78,1197,1,20826,367,0,0,-1
雷奥利斯领主,雷奥利斯是现存最古老的元素生物之一，他源自创造艾泽拉斯的洪荒烈焰。他负责在火焰之地创造新的元素，同时他认为那些将他迁移的泰坦们过于的傲慢，这股仇恨仍在他胸中燃烧。,0.65369326,0.7500001,193,78,1204,2,20812,367,0,0,-1
奥利瑟拉佐尔,当拉格纳罗斯的军队涌入海加尔山时，绿龙奥利瑟拉背叛了盟军，帮忙把叛变的大德鲁伊范达尔·鹿盔放了出来。作为奖赏，她被烈焰所净化，重生成了一只可怕的火鹰。,0.6437137,0.38023955,194,78,1206,3,20817,367,0,0,-1
沙恩诺克斯,在火焰之地的元素守护者中，火妖是最为恐怖的一类。沙恩诺克斯也不例外。身为拉格纳罗斯帐下的首席猎人兼熔火恶犬驯犬人，沙恩诺克斯巡视着这块元素的领域，陪伴着他的是两只最为凶猛的畜生：裂肢和狂脸。,0.49301347,0.44311342,195,78,1205,4,20808,367,0,0,-1
护门人贝尔洛克,在上古时代艾泽拉斯的元素战争中，贝尔洛克作为一名无情的战士而声名鹊起。如今他被困在了火焰之地，变得愈发不理智起来。很少有元素敢来打扰他，生怕牺牲在他对战斗的渴望之下。,0.4950096,0.3098805,196,78,1200,5,20822,367,0,0,-1
管理者鹿盔,在流沙之战中痛失爱子瓦斯坦恩一事，彻底击垮了范达尔·鹿盔的精神。现在，他被拉格纳罗斯灌注力量，成了火焰之地新任的管理者（顶替死亡的管理者埃克索图斯），并兼任背叛塞纳里奥议会的烈焰德鲁伊首领。范达尔宁愿毁掉艾泽拉斯，也不要活在这个失去爱子的世界里。,0.5099801,0.72455096,197,78,1185,6,20830,369,0,0,-1
拉格纳罗斯,火焰之地的领主拉格纳罗斯象征着愤怒与毁灭，一如铸就了艾泽拉斯的原初地狱之火。上古之神向拉格纳罗斯保证，他有机会把艾泽拉斯变成一片火海，而耐普图隆和塞拉赞恩将对此无能为力。为了取悦上古之神，拉格纳罗斯誓要点燃诺达希尔的世界之树。,0.507502,0.15383,198,78,1203,7,20834,369,0,0,-1
泰兰德的残影,作为前暗夜精灵领袖及艾露恩高阶祭司，这个位于错乱时空中的泰兰德·语风的残影在艾泽拉斯未来的废土上徘徊。她被永恒的黑夜包围，几乎看不清艾露恩那令人慰藉的光辉。,0.515514,0.433775,283,184,1884,4,3667,405,0,0,-1
吉安娜的残影,吉安娜·普罗德摩尔饱受折磨的投影已经惨遭撕裂并被注入了她的法杖碎片中。为了恢复时间流的平衡，你必须击败这个残影。可是，这位骄傲的前塞拉摩统治者掌握着毁灭性的魔法力量，而她这个时空错乱的幽灵投影同样如此。在这个未来的艾泽拉斯，她只是被分裂了，并且等待着……,0.495389,0.660817,285,184,1883,2,3641,402,0,0,-1
姆诺兹多,游离于时间流之外，如今的姆诺兹多正是曾经崇高的时光之王，守护巨龙诺兹多姆。由于泰坦让诺兹多姆亲眼目睹了自己的死亡，饱受折磨的巨龙被上古之神所蒙骗。他企图扭转自己的宿命。于是，诺兹多姆破坏了时间的正常流转，并创造出了永恒之龙…艾泽拉斯的未来将被摧毁。,0.484811,0.323013,289,184,1271,5,3675,406,0,0,-1
