ID,Description_lang,OrderIndex,ProfTraitTreeID
1,制作原始熔火板甲。,0,105
2,制作板甲时，提高你的奇思和充裕属性。,1,105
3,制作大师之锤，可以免费修理你自己的板甲。,2,105
5,精通布卷和抛光布的制造。,1,161
6,精通合约和公函的制造。,2,176
7,喝下药水可以获得少量的移动速度爆发或者治疗效果爆发。,1,58
8,制造诱饵，吸引一些生物，剥皮时可以获得稀有材料。,0,145
9,精通动物符文和凡图斯符文的制造。,2,148
10,用附加材料和成品材料自定义你制造的武器和工具。,2,102
11,用附加材料和成品材料自定义你制造的皮甲。,2,126
12,用附加材料和成品材料自定义你制造的锁甲。,2,124
13,用附加材料自定义戒指和项链。,2,131
14,选矿时可以发现棱光矿石，里面有数个宝石。,0,128
15,制造物品时，提升你的充裕属性和制造效率。,2,207
16,能够发现魔法种子，可以种在土壤里，长出草药。,1,235
17,在户外时，获得对野兽和龙类的伤害加成。,0,144
18,制作布甲时，提高你的奇思和充裕属性。,1,164
19,制作附魔时，提高你的奇思和充裕属性。,2,240
20,制作皮甲时，提高你的奇思和充裕属性。,1,126
21,制作锁甲时，提高你的奇思和充裕属性。,1,124
22,制作任意珠宝加工图鉴时，提高你的奇思、充裕和制作速度属性。,0,130
23,制作任意珠宝加工图鉴时，提高奇思和充裕属性的效果。,1,130
24,制作任意珠宝加工图鉴时，提高你的制作技能。,0,130
25,能够发现附加材料结构图来自定义你的装备。,1,205
26,制作大师之锤，可以修理你自己的武器。,3,102
27,可以通过实验学习毒素药水和毒素瓶剂配方。,3,59
28,可以收集废料，以便在里面翻捡宝藏。,1,207
29,能够使用成品材料来自定义布甲。,2,164
30,从你剥皮的生物身上收集烹饪肉类。,2,144
31,制造物品时，驾驭腐朽魔法。,3,134
32,驾驭元素材料，强化你切割的宝石。,1,129
33,提高你的收集暗月卡片，提取其元素，以及制造新卡片的能力。,0,176
34,制作任意炼金配方时，提升你的制作技能。,0,59
35,制作任意锻造配方时，提升你的制作技能。,0,169
36,制作任意附魔公式时，提高你的制作技能。,0,245
37,制作任意工程学结构图时，提高你的制作技能。,0,207
38,制作任意铭文工艺图时，提高你的制作技能。,0,147
39,制作任意制皮图样时，提高你的制作技能。,0,135
40,制作任意裁缝图样时，提高你的制作技能。,0,160
41,制作任意裁缝图样时，提升你的制作速度。,3,160
42,采集草药时，提高你的采集技能。,0,236
43,采集革、鳞和皮时，提高你的技能。,0,143
44,采集矿石时，提高你的技能。,0,212
45,制作合金和附加材料时的品质获得提升。,1,103
46,精进转化的技艺，可以把一种东西变成另外一种。,2,59
47,提高大量制作基础材料的技艺。,2,128
48,使用更少的材料来大量制造炸弹。,1,204
49,制造PvP装备时，提高你的制作技能。,2,134
50,制作附魔公式时，提高你的制作技能。,0,240
51,提升制作可消耗的塑像的技艺，塑像可提供少量的战斗加成。,3,131
52,提高你瓶剂实验的成功率。,0,84
53,提高你药水实验的成功率。,0,58
54,制作任意锻造配方时，提高你的制作速度。,2,169
55,提高采集时发现的草药数量。,2,236
56,提高你采矿时发现的矿石数量。,2,212
57,你使用瓶剂的持续时间延长。,1,84
58,提高采集草药时精细属性的效果。,3,236
59,提高所有公式的奇思和充裕属性的效果。,3,245
60,提高所有图样的奇思和充裕属性的效果。,3,135
61,提高所有配方的奇思和充裕属性的效果。,1,160
62,提高所有配方的奇思和充裕属性的效果。,1,169
63,提高所有工艺图的奇思和充裕属性的效果。,3,147
64,采集元素矿脉时，提高你的熟练、精细和感知属性。,3,213
65,采集元素草药时，提高你的熟练、精细和感知属性。,3,234
66,采集草药时，提高你的熟练、精细和感知属性。,2,235
67,开采矿石时，提高你的熟练、精细和感知属性。,2,211
68,剥皮时，提高你的熟练、精细和感知属性。,2,143
69,剥皮时，提高你的熟练、精细和感知属性。,2,145
70,提升你的分解能力，有时候可以获得额外的材料。,1,244
71,提高你的感知属性，帮助你获得更稀有的材料。,3,144
72,将元素能量灌注进诱饵里，使你可以收集活力元素。,1,145
73,发明各种各样的玩具，为你和周围的人提供娱乐。,1,206
74,学习用元素精华切割无限钻石。,2,129
75,制作刺绣包时，提升你的充裕属性。,2,161
76,将优秀品质的宝石转化为精良品质的宝石簇。,1,128
77,制作和升级龙洞发生器，从而迅速进行传送。,0,206
78,制作所有人都能使用的带匠械插槽的史诗品质的护腕。,0,205
79,学习如何使用成品材料来改进你切割的宝石。,0,129
80,学习带特效的装备和附加材料的图样。,0,134
81,学习强力的“龙”、“之祈”和“觉醒”附魔公式。,1,240
82,学习各种拥有不同效果的炸弹的结构图。,0,204
83,学习新的匠械的结构图，匠械可以用在有匠械插槽的装备上。,2,206
84,制作一根原始觉醒火炬和一条符文卡兹格罗金棒。,1,245
85,雕刻耀光群岛之柱和动能群岛之柱，它们是强力的法杖。,1,148
86,更有效率地收集布，以及发现可以拆解的稀有布。,2,160
87,制作卡兹格罗金铁匠工具盒，以及制作更高品质的工具。,0,103
88,制作各种强力的崭新戒指和项链。,1,131
89,制作和自定义暗月套牌盒，它们是强力的暗月饰品。,1,176
90,制作有独特加成的护甲，比如苍蓝披肩。,1,162
91,制作鱼饵来捕捉特定种类的鱼。,1,144
92,制作焰触锁甲。,0,124
93,制作青纹和时序布护甲，它们都有独特的套装加成。,0,162
94,制作命缚皮甲。,0,126
95,制作采矿和锻造工具。,1,102
96,制作原始熔火武器。,0,102
97,制作抄写员的明灿羽毛笔。,0,148
98,制作多层勋章镶嵌底座，用来给项链添加插槽。,0,131
99,制作生机荒布护甲。,0,164
100,制作好玩的幻影物品，为大家的生活增添乐趣。,2,245
101,制作更安全的炸弹，可供所有玩家使用。,3,204
102,制作气阀灵魂吸入器，这是一种很重要的装置，可以收集关键材料。,3,207
103,发现玄秘物品，可以分解为材料和活力元素。,0,244
104,在拆解稀有布料时发现活力元素。,0,161
105,在骑乘坐骑的状态下采集草药。,0,235
106,从元素矿脉采集更多的活力元素。,1,213
107,从元素草药采集更多的活力元素。,1,234
108,在骑乘坐骑的状态下采集矿脉。,0,211
109,打碎觉醒元素，从而获得暂时的战斗和制作加成。,3,244
110,附魔材料碎裂为较低稀有度的同类材料。,2,244
111,撰写巨龙论述，可以使读者增加专业知识。,3,176
112,精通强化石的制作，比如原始磨刀石和原始平衡石。,2,103
113,精通有套装加成的装备的制作。,1,134
114,精通墨水的制作，这是铭文师的主要材料。,2,147
115,精通制作魔法强化的布甲。,2,162
116,精通专业配饰和鼓的制作。,2,135
117,精通基础材料、附加材料和成品材料的制作。,1,59
118,把材料研磨为颜料时，提高你的制作技能和效率。,1,147
119,制作护甲片和材料时，提高你的制作技能。,1,135
120,你每进行一次采矿，过载元素采矿点的冷却时间就会缩短。,0,213
121,你每采集一次，过载元素草药的冷却时间就会缩短。,0,234
122,提升你对炸弹的处理能力，降低部署炸弹时发生可怕的走火的几率。,2,204
123,降低开采元素矿脉时的负面副作用。,2,213
124,降低采集元素草药时的负面副作用。,2,234
125,将你的较低品质的草药精制为较高品质。,1,236
126,将你的较低品质的矿石精制为较高品质。,1,212
127,将你的较低品质的材料精制为较高品质。,1,143
128,提升装置的可靠性，降低部署时发生故障的几率。,3,206
129,在采矿时，偶尔可以发现稀有宝石或无限钻石。,1,211
130,制作瓶剂时，提升你的产能属性和产能的效果。,2,84
131,提高大量制作药水的能力。,2,58
132,专精于制作远程武器的瞄准镜和弹药。,2,205
145,采集草药时，提高你的熟练、精细和感知属性。,2,257
146,学习如何在陨圣峪的贝雷达尔之慷播撒和栽培种子。,1,257
147,在骑乘坐骑的状态下采集草药。,0,257
148,采集强化的草药时，提高你的精细和感知属性。,2,258
149,降低采集强化的草药时的负面效果，并获得额外收益。,1,258
150,采集时缩短过载强化草药的冷却时间。,0,258
151,可以从其他来源采集稀有且隐秘的虚无之莲。,3,259
152,学习如何将草药精制为较高品质。,2,259
153,提高采集草药时精细属性的效果。,1,259
154,采集草药时，提高你的技能。,0,259
192,剥皮时，提高你的熟练、精细和感知属性。,3,271
193,制作特定鱼类的诱饵。,2,271
194,从被剥皮的生物身上获取更多稀有材料。,1,271
195,从被剥皮的生物身上收集用于烹饪的肉类。,0,271
196,剥皮时，提高你的熟练、精细和感知属性。,2,272
197,为诱饵注入卡兹阿加各地的强大能量，使你能够采集额外材料。,1,272
198,制造诱饵，吸引一些生物，剥皮时可以获得稀有材料。,0,272
199,将你的较低品质的材料精制为较高品质。,2,273
200,剥皮时提高你的技能。,1,273
201,学习打磨小刀，剥皮时必定获得皮。,0,273
243,制作护甲片和其他消耗品时，获得额外的技能和充裕。,2,287
244,学习制作具有各类效果的修饰。,1,287
245,提高制作专业技能装备的能力。,0,287
249,提高同时制作众多消耗品和材料的能力。,2,289
250,提高激活充裕时节省材料的能力。,1,289
251,提高所有图样的专注和奇思的效果。,0,289
252,制作皮甲时提高你的奇思、充裕和技能。,2,290
253,用附加材料和成品材料自定义你制造的皮甲。,1,290
254,学习制作史诗符烙皮甲。,0,290
255,制作锁甲时提高你的奇思、充裕和技能。,2,291
256,用附加材料和成品材料自定义你制造的锁甲。,1,291
257,学习制作史诗刻纹锁甲。,0,291
279,制作珠宝时提高技能、充裕并降低专注消耗。,3,298
280,提高制作专业配饰的能力。,2,298
281,可以使用附加材料自定义珠宝。,1,298
282,学习如何制作强大的项链和戒指图样。,0,298
295,制作包含未切割宝石的棱镜。,3,302
296,切割宝石时获得额外技能。,2,302
297,切割宝石时保留成品材料碎片，未来切割宝石时可用于提高技能。,1,302
298,学习如何使用成品材料来改进你切割的宝石。,0,302
299,制作材料时获得额外技能与充裕。,2,303
300,提高你在选矿时发现宝石和材料的能力。,1,303
301,学习制作多种附加材料，包括元素焦镜。,0,303
334,制作合剂和瓶剂时获得满溢。,3,312
335,制作药剂和瓶剂时提高你的产能、充裕和技能。,2,312
337,学习制作合剂大锅。,1,312
338,每天可以制作额外的灵魂绑定合剂。,0,312
339,使用特定草药制作配方时，提高你的技能和奇思，并降低专注消耗。,3,313
340,使用草药组合制作材料。,2,313
341,提高发现新炼金配方的几率。,1,313
342,使用卡兹阿加的草药进行实验时降低风险，提高收益。,0,313
343,制作药水时提高你的产能、充裕和技能。,2,314
344,学习制作药水大锅。,1,314
346,每天可以制作额外的灵魂绑定魔法药水。,0,314
347,施展奇术或转化时，提高你的充裕、技能和产出。,2,315
348,制作心核隧途触媒。,1,315
349,施展奇术或转化时获得额外的转化剂。,0,315
350,制作护甲和盾牌时获得额外技能。,3,316
351,提高你使用大师之锤修理装备的能力。,2,316
352,制作护甲和盾牌时可以使用附加材料和成品材料以提高效果。,1,316
353,学习制作史诗品质的板甲和盾牌。,0,316
354,获得额外的永燃点火装置使用次数，并降低冷却速度。,2,317
355,强化永燃点火装置，使其进一步提供额外的奇思、产能和充裕。,1,317
356,学习制造永燃点火装置，点燃你的制作能力。,0,317
361,制作武器时获得额外技能。,3,320
362,提高你使用大师之锤修理装备的能力。,2,320
363,制作武器时可以使用附加材料和成品材料以提高效果。,1,320
364,学习制作史诗品质的武器。,0,320
367,提高制作消耗品的能力，包括武器石和框架。,1,322
368,制作专业技能装备时可以使用附加材料和成品材料以提高效果。,0,322
369,在提取暗月卡片时获得眷顾好运。,2,323
370,在制作凡图斯符文、合约、公函时获得可叠加的制作速度。,1,323
371,解锁提取和制作多种暗月卡片的能力。,0,323
372,制作武器和专业装备时消耗更少的专注。,2,324
373,制作武器和专业装备时获得更多充裕并提高效率。,1,324
374,Learn to craft (NYI)T2 Inscription Quill.,0,324
375,获得大量奇思、产能和充裕。,1,325
376,学习制作论述，并能每周额外使用一次论述。,0,325
377,在研磨或制作材料时获得额外技能。,1,326
378,提高批量研磨和制作材料的速度。,0,326
379,解锁在分解史诗物品时偶尔提取魔法精华的能力。,2,327
380,提高你在分解时可以获得的风暴之尘和粼光碎片的数量。,1,327
381,提高分解时获得的附魔材料的品质。,0,327
382,掌握消耗品的公式，提高效果。,2,328
383,学习如何制作强力的魔杖和附魔棒。,1,328
384,提高你的幻象的品质，延长持续时间。,0,328
385,完全专精一个永久附魔时，减少专注所需的专注量。,2,329
386,学习多种新公式来强化装备。,1,329
387,提高永久附魔的品质。,0,329
388,提高消耗产品的产能。,2,330
389,提高专注和奇思的效率。,1,330
390,学习如何粉碎魔法精华获得临时加成，效果随专精提高。,0,330
391,提高你采矿的速度，让你有时间采更多的矿！,3,331
392,提高你采集稀罕的虚无石的能力。,2,331
393,学习精制配方，让你可以提高小批量矿石的品质。,1,331
394,采集你选择专精的矿石时提高技能，以获得更高品质的矿石。,0,331
395,采矿时脱落的大块矿石也可以开采，从而获得额外的产量。,2,332
396,在卡兹阿加采矿时提高精细、熟练和感知。,1,332
397,学习如何在骑乘坐骑的状态下采集矿脉。,0,332
398,额外获得一层过载充能。,2,333
399,学习如何保护自己，并从卡兹阿加的特殊矿脉中获得更高的产量。,1,333
400,采矿时获得大量的过载冷却缩减。,0,333
401,将晨纹布和暮纹布的丝线注入强大的套装装备中。,3,334
402,每天可以更频繁地制作暮纹布卷和晨纹布卷。,2,334
403,制作可供所有类型冒险者使用的独特附加材料。,1,334
404,学习以晨之光和暮之影的魔法协调性为中心的配方。,0,334
405,将晨纹布和暮纹布的丝线注入强大的套装装备中。,3,335
406,每天可以更频繁地制作暮纹布卷和晨纹布卷。,2,335
407,制作可供所有类型冒险者使用的独特附加材料。,1,335
408,学习以晨之光和暮之影的魔法协调性为中心的配方。,0,335
409,添加附加材料和成品材料，进一步强化圣化装备。,3,336
410,制作圣化装备时获得额外技能。,2,336
411,让你的圣化装备可以获得更高的物品等级 ,1,336
412,将梭绸布圣化为强大的圣化装备。,0,336
413,添加附加材料和成品材料，进一步强化圣化装备。,3,337
414,制作圣化装备时获得额外技能。,2,337
415,让你的圣化装备可以获得更高的物品等级 ,1,337
416,将梭绸布圣化为强大的圣化装备。,0,337
417,添加附加材料和成品材料，进一步强化圣化装备。,3,338
418,制作圣化装备时获得额外技能。,2,338
419,让你的圣化装备可以获得更高的物品等级 ,1,338
420,将梭绸布圣化为强大的圣化装备。,0,338
427,学习如何用修饰、公函和齿轮来强化你的装备制作。,2,341
428,解锁新的战斗和专业装备配方。,1,341
429,制作所有类型的装备时都能获得大量技能加成。,0,341
430,掌握一种独门技术，可以使显然爆炸的炸药保留下来。,2,342
431,有效提高你制作匠械、爆炸物和其他装置的能力。,1,342
432,对于装置的处理方式更加胸有成竹，可以减少出现灾难性后果的可能性。,0,342
433,提高效率，能更好地处理你的废料。,2,343
434,提高你发明新工具的能力，并能从错误中吸取教训。,1,343
435,所有工程学工艺获得大量技能加成。,0,343
440,提高你使用的材料的品质，完善你的裁缝天地。,3,345
441,成为可以制造用于多种制作工艺的高品质成品材料的专家。,2,345
442,完善你的技艺，能够编解最高品质的布料。,1,345
443,制造可以供所有类型的冒险家使用的强大魔线。,0,345
444,提高所有配方的产能属性的效果。,3,346
445,提高所有配方的充裕属性的效果。,2,346
446,提高所有配方的奇思属性的效果。,1,346
447,提高你在卡兹阿加找到的布料数量。,0,346
448,添加附加材料和成品材料，进一步强化圣化装备。,3,347
449,制作圣化装备时获得额外技能。,2,347
450,让你的圣化装备可以获得更高的物品等级 ,1,347
451,将梭绸布圣化为强大的圣化装备。,0,347
452,使用强大的暗月徽记修饰你的装备。,2,348
453,提高你制作合约、公函和凡图斯符文的能力。,1,348
454,了解如何抄录并寻找卡兹阿加的暗月卡片。,0,348
455,改进装备制作工艺，节省资源。,2,349
456,制造可以在战斗中使用的高品质法杖和副手装备。,1,349
457,掌控你的技艺，完善其他专业工具。,0,349
458,大幅提高你的制作属性，包括奇思、充裕和产能。,2,350
459,每周能从论述中提取更多知识。,1,350
460,成为编写可供所有专业使用的阿加论述的专家。,0,350
461,制造所有铭文材料时获得额外技能。,1,351
462,学习如何在批量制作时快速制造铭文材料。,0,351
463,使用强大的暗月徽记修饰你的装备。,2,352
464,提高你制作合约、公函和凡图斯符文的能力。,1,352
465,了解如何抄录并寻找卡兹阿加的暗月卡片。,0,352
466,添加附加材料和成品材料，进一步强化圣化装备。,3,353
467,制作圣化装备时获得额外技能。,2,353
468,让你的圣化装备可以获得更高的物品等级 ,1,353
469,将梭绸布圣化为强大的圣化装备。,0,353
470,使用强大的暗月徽记修饰你的装备。,2,354
471,提高你制作合约、公函和凡图斯符文的能力。,1,354
472,了解如何转写与寻找卡兹阿加的暗月卡片。,0,354
