Description_lang,Title_lang,ID,ScenarioID,CriteriatreeID,RewardQuestID,RelatedStep,Supersedes,OrderIndex,Flags,VisibilityPlayerConditionID,WidgetSetID
从血肉之子的袭击中营救维库人。,东部林地,5387,2136,140708,0,0,0,0,0,0,0
你已经跟伊崔格一起来到了霜狼氏族的领地。你应该跟随他前去面见德雷特塔尔。,家庭拜访,5388,2137,140747,0,0,0,0,0,0,0
你来到霜狼要塞，与伊崔格、萨尔、阿格娜以及他们的孩子见面。是是时候讨论克许哈格的回归了。,重大事宜,5389,2137,140749,0,0,0,1,0,0,0
德雷克塔尔向你发出了挑战！击败杜洛斯和德拉坎，证明你有资格成为第一个完成新仪式的兽人。,德雷克塔尔的挑战,5390,2137,140751,0,0,0,2,0,0,0
,Null script only,5391,2138,0,0,0,0,0,0,0,0
,All possible null fields,5392,2138,0,0,0,0,1,0,0,0
关闭元素传送门,暴风之怒,5394,2139,142292,0,0,0,0,0,0,0
击败拜荒者怪物！,拜荒者的进军,5395,2139,142294,74378,0,0,1,0,0,0
你击败了德雷克塔尔的两只狼，但他还没认输！,先知的能量,5396,2137,142821,0,0,0,3,0,0,0
击败元素，从而削弱风暴。,阵风前线,5398,2140,142595,0,0,0,0,0,0,0
击败元素，从而削弱风暴。,坚守阵地,5399,2141,142599,0,0,0,0,0,0,0
击败元素，从而削弱风暴。,炽热的交锋,5400,2142,142603,0,0,0,0,0,0,0
击败元素，从而削弱风暴。,恐惧之雨,5401,2143,142607,0,0,0,0,0,0,0
击败林地中的上古之神部队，并集结维库人。,基希克斯时间,5402,2136,142563,0,0,0,1,0,0,0
帮助艾隆纳亚和阿扎达斯击败基希克斯。,同盟编年史,5403,2136,142564,0,0,0,2,0,0,0
清理林地中剩余的上古之神部队，并集结维库人。,幽暗林地,5404,2136,142565,0,0,0,3,0,0,0
直面扎卡兹。,提尔的最后一搏,5405,2136,142566,0,0,0,4,0,0,0
击败扎卡兹的幻象。,扎卡兹的守护巨龙,5406,2136,142567,0,0,0,5,0,0,0
击败扎卡兹。见证提尔的终极牺牲。,提尔之陨,5407,2136,142568,0,0,0,6,0,0,0
玛里苟斯和辛达苟萨的精华被转移到了碧蓝魔馆中。是时候释放它们了！,与卡雷苟斯交谈,5410,2145,142577,0,0,0,0,0,0,0
抵御辛达苟萨的狂怒！,击败辛达苟萨,5411,2145,142579,0,0,0,1,0,0,0
安抚辛达苟萨和玛里苟斯。,与卡雷苟斯交谈,5412,2145,144721,0,0,0,2,0,0,0
击败汉苏尔。,风暴之眼,5414,2140,142593,0,0,0,1,0,0,0
击败希尔娜·峭心。,风暴之眼,5415,2141,142589,0,0,0,1,0,0,0
击败菲尔林。,风暴之眼,5416,2142,142587,0,0,0,1,0,0,0
击败修科洛·驯湍。,风暴之眼,5417,2143,142581,0,0,0,1,0,0,0
查拉雷克洞窟到处都是拜荒者！,地表之下,5418,2146,142625,0,0,0,0,0,0,0
消灭塑峰者洛莱克。,爪下蝼蚁,5420,2146,142629,0,0,0,3,0,0,0
你已经证明了自己有资格成为第一个完成新仪式的兽人。是时候开始为克许哈格做准备了！,仪式前的准备,5422,2137,142360,0,0,0,4,0,0,0
菲莱克正和他的信徒一起飞向弥散营地。做好战斗的准备！,菲莱克来了！,5423,2148,142854,0,0,0,0,0,0,0
击败菲莱克的信徒。,火焰之怒,5424,2148,142852,0,0,0,1,0,0,0
元素开始翻腾。,准备,5425,2149,142856,0,0,0,0,0,0,0
给雷电导管充能。,能量提升,5426,2149,142858,0,0,0,1,0,0,0
击败充能的幼龙。,威胁！,5427,2149,142860,0,0,0,2,0,0,0
拾取万雷宝箱。,成功,5428,2149,142862,0,0,0,3,0,0,0
击败碎裂之焰巡逻队。,出师不利,5459,2152,143235,0,0,0,0,0,0,0
清理西南部的泰坦封锁部队,净化封锁,5460,2152,143239,74906,0,0,1,0,0,756
碎裂之焰的部队已被击败。现在可以安全地告知拉南，他的研究员已经收集到了数据，可以撤退了。,逃出生天,5463,2152,143237,74905,0,0,21,0,0,0
击败大地拜荒者部队和山崖护卫博达妮。,撼山易事,5464,2146,143185,0,0,0,1,0,0,0
你抵达了大漩涡。与诺兹多姆交谈，了解接下来该怎么做。,和诺兹多姆谈一谈,5469,2154,143358,0,0,0,0,0,0,0
使用打造的手套，收取死亡之翼的最后一息黑龙精华。,吸收死亡之翼的精华,5470,2154,143459,0,0,0,1,0,0,0
一名上古之神的使者从死亡之翼体内出现了！,击败无面者,5471,2154,143461,0,0,0,2,0,0,0
再次尝试收取死亡之翼的精华。,收取死亡之翼的精华,5472,2154,143467,0,0,0,3,0,0,0
可以从朱尼克处购买千噬水虎鱼下巴，她位于锅南面的帐篷附近。,凶凶的,5473,2155,143363,0,0,0,0,0,0,663
把千噬水虎鱼下巴扔进锅里！,千噬水虎鱼下巴,5474,2155,143411,74382,0,0,1,0,0,663
可以从帕丘处购买大家伙碎屑，她位于锅南面的帐篷附近。,省省的,5475,2156,143365,0,0,0,0,0,0,663
把大家伙碎屑扔进锅里！,大家伙碎屑,5476,2156,143413,74382,0,0,1,0,0,663
可以从阿尔非克处购买海巨人肝油，他位于锅的西面的帐篷附近。,苦苦的,5477,2157,143367,0,0,0,0,0,0,663
把海巨人肝油倒进锅里！,海巨人肝油,5478,2157,143415,74382,0,0,1,0,0,663
可以从诺卢克处购买诺卢克的“万用”鱼粉，他位于锅的西面的帐篷附近。,怪怪的,5479,2158,143369,0,0,0,0,0,0,663
把诺卢克的“万用”鱼粉撒进锅里！,诺卢克的“万用”鱼粉,5480,2158,143417,74382,0,0,1,0,0,663
可以从塔图基亚卡处购买发酵鲭鱼糊，她位于锅南面的帐篷附近，就在猛犸象背后。,腥腥的,5481,2159,143371,0,0,0,0,0,0,663
把发酵鲭鱼糊挤进锅里！,发酵鲭鱼糊,5482,2159,143419,74382,0,0,1,0,0,663
可以从罗库图克处购买深渊鱿鱼墨汁，他位于锅南面的码头附近。,黑黑的,5483,2160,143373,0,0,0,0,0,0,663
把深渊鱿鱼墨汁倒进锅里！,深渊鱿鱼墨汁,5484,2160,143421,74382,0,0,1,0,0,663
可以在提库克处购买岛屿蟹肉干，他位于城镇西南角的码头附近。,浓浓的,5485,2161,143375,0,0,0,0,0,0,663
把岛屿蟹肉干扔进锅里！,岛屿蟹肉干,5486,2161,143423,74382,0,0,1,0,0,663
可以在哈努处购买鲈鱼之眼，她位于锅西部的帐篷附近。,壮壮的,5487,2162,143377,0,0,0,0,0,0,663
把鲈鱼之眼扔进锅里！,鲈鱼之眼,5488,2162,143425,74382,0,0,1,0,0,663
可以从卡尔因·多图尔处购买七重辣椒驼牛肉，她在锅南面的路上巡逻。,重辣的,5489,2163,143379,0,0,0,0,0,0,663
把七重辣椒驼牛肉扔进锅里！,七重辣椒驼牛肉,5490,2163,143427,74382,0,0,1,0,0,663
可以从卡尔因·多图尔处购买龙焰绒羊肉，她在锅南面的路上巡逻。,烫烫的,5491,2164,143381,0,0,0,0,0,0,663
把龙焰绒羊肉扔进锅里！,龙焰绒羊肉,5492,2164,143429,74382,0,0,1,0,0,663
可以从卡尔因·多图尔处购买三次烤焦的猛犸肋排，她在锅南面的路上巡逻。,焦焦的,5493,2165,143383,0,0,0,0,0,0,663
把三次烤焦的猛犸肋排扔进锅里！,三次烤焦的猛犸肋排,5494,2165,143431,74382,0,0,1,0,0,663
可以从卡尔因·多图尔处购买“火山”鸭肉，她在锅南面的路上巡逻。,轰轰的,5495,2166,143385,0,0,0,0,0,0,663
把“火山”鸭肉扔进锅里！,“火山”鸭肉,5496,2166,143433,74382,0,0,1,0,0,663
可以在格拉库斯处购买绿莓，他在锅上面的山脊上巡逻。,酸酸的,5497,2167,143387,0,0,0,0,0,0,663
把绿莓扔进锅里！,绿莓,5498,2167,143435,74382,0,0,1,0,0,663
可以在格拉库斯处购买新鲜的龙果，他在锅上面的山脊上巡逻。,甜甜的,5499,2168,143389,0,0,0,0,0,0,663
把新鲜的龙果扔进锅里！,新鲜的龙果,5500,2168,143437,74382,0,0,1,0,0,663
可以在格拉库斯处购买多汁的灌木果，他在锅上面的山脊上巡逻。,脆脆的,5501,2169,143391,0,0,0,0,0,0,663
把多汁的灌木果扔进锅里！,多汁的灌木果,5502,2169,143439,74382,0,0,1,0,0,663
可以在格拉库斯处购买风干的寒流簇叶，他在锅上面的山脊上巡逻。,绿绿的,5503,2170,143393,0,0,0,0,0,0,663
把风干的寒流簇叶扔进锅里！,风干的寒流簇叶,5504,2170,143441,74382,0,0,1,0,0,663
可以从艾鲁苟萨处购买欧恩哈拉土豆，她就在锅附近。,丰盛的,5505,2171,143395,0,0,0,0,0,0,663
把精致的欧恩哈拉土豆扔进锅里！,精致的欧恩哈拉土豆,5506,2171,143443,74382,0,0,1,0,0,663
可以从艾鲁苟萨处购买油酥面团，她就在锅附近。,油油的,5507,2172,143397,0,0,0,0,0,0,663
把油酥面团扔进锅里！,油酥面团,5508,2172,143445,74382,0,0,1,0,0,663
可以从艾鲁苟萨处购买暗色索德拉苏斯可可粉，她就在锅附近。,颓颓的,5509,2173,143399,0,0,0,0,0,0,663
把暗色索德拉苏斯可可粉撒进锅里！,暗色索德拉苏斯可可粉,5510,2173,143447,74382,0,0,1,0,0,663
可以从艾鲁苟萨处购买四合一奶酪，她位于锅的右面。,臭臭的,5511,2174,143401,0,0,0,0,0,0,663
把四合一奶酪撒进锅里！,四合一奶酪,5512,2174,143449,74382,0,0,1,0,0,663
可以从厨师长斯塔克斯处购买口粮：蝎肉大餐，它位于锅北面的山脊上。,可疑的,5513,2175,143403,0,0,0,0,0,0,663
把口粮：蝎肉大餐扔进锅里！,口粮：蝎肉大餐,5514,2175,143451,74382,0,0,1,0,0,663
可以从厨师长斯塔克斯处购买口粮：安德麦蚌肉杂烩，它位于锅北面的山脊上。,黏黏的,5515,2176,143405,0,0,0,0,0,0,663
把口粮：安德麦蚌肉杂烩倒进锅里！,口粮：安德麦蚌肉杂烩,5516,2176,143453,74382,0,0,1,0,0,663
可以从厨师长斯塔克斯处购买口粮：西部荒野杂味炖肉 ，它位于锅北面的山脊上。,舒心的,5517,2177,143407,0,0,0,0,0,0,663
把口粮：西部荒野杂味炖肉倒进锅里！,口粮：西部荒野杂味炖肉,5518,2177,143455,74382,0,0,1,0,0,663
可以从厨师长斯塔克斯处购买口粮：龙息红椒，它位于锅北面的山脊上。,烫烫的,5519,2178,143409,0,0,0,0,0,0,663
把口粮：龙息红椒倒进锅里！,口粮：龙息红椒,5520,2178,143457,74382,0,0,1,0,0,663
纳兹乌罗，无拘传承属于你！,新传承,5521,2154,143469,0,0,0,4,0,0,0
攻击巨硕的狮子鱼，或者和它互动，从而尽量多获得一些肉！,巨硕的狮子鱼,5524,2179,143496,70925,0,0,0,0,0,663
攻击巨大的刺魟，或者和它互动，从而尽量多获得一些肉！,巨大的刺魟,5525,2180,143502,70925,0,0,0,0,0,663
攻击巨大的长尾鲨，或者和它互动，从而尽量多获得一些肉！,巨大的长尾鲨,5526,2181,143504,70925,0,0,0,0,0,663
击败旋云之巅的首领,旋云之巅,5529,2184,143614,0,0,0,0,0,0,0
基础步骤描述1A,场景战役开始1A,5530,2185,143669,0,0,0,0,0,0,0
清理蕨皮山谷！,蕨皮山谷,5532,2187,143773,0,0,0,0,0,0,0
调查奥达曼，获取提尔的圆盘！,奥达曼：提尔的遗产,5533,2188,143778,0,0,0,0,0,0,0
清理奈萨鲁斯。,奈萨鲁斯,5534,2189,143784,0,0,0,0,0,0,0
调查注能大厅。,注能大厅,5535,2190,143789,0,0,0,0,0,0,0
基础步骤描述1B,场景战役开始1B,5536,2185,143796,0,0,0,0,0,0,0
基础步骤描述2,场景战役2,5537,2185,144181,0,0,0,1,0,0,0
清理阻挡主控制台的巨石，收集泰坦部件，帮助葛雷塔进行维修。,混乱封锁,5538,2152,143894,74906,0,0,2,0,0,756
击败泰坦封锁部队，使葛雷塔有时间收集数据。,泰坦的反击,5539,2152,143896,74906,0,0,9,0,0,0
碎裂之焰援军到了。坚持守护营地，直到研究员撤退为止。,显然不受待见,5540,2152,143904,74906,0,0,19,0,0,0
碎裂之焰的首领雷卡尔上尉已经上阵，想亲手宰了拉南。,扑火之酋,5541,2152,143900,74906,0,0,20,0,0,0
击败火焰拜荒者部队和传送门守护者西姆布拉,菲莱克和硫磺,5542,2146,144009,0,0,0,2,0,0,0
把奇特的矿石样本放进矿石处理器，帮助葛雷塔中和污染物。,中和污染物,5546,2152,144237,74906,0,0,6,0,0,756
我们与泰坦部队的争执惹毛了当地的野生动物。,敌对调查者,5547,2152,144240,74906,0,0,3,0,0,756
闯入洞穴，找到污染物。,探洞,5548,2152,144241,74906,0,0,4,0,0,756
阻止被污染的野生动物逃离此区域。,受影响的野生动物,5549,2152,144244,74906,0,0,7,0,0,756
最后的污染物凝结成了充满敌意的元素，必须摧毁它。,剧烈反应,5550,2152,144247,74906,0,0,8,0,0,756
清理此区域的敌对野生动物。,惹毛了,5551,2152,144252,74906,0,0,10,0,0,805
一名剥石者主母从洞窟的岩顶飞了下来，想摧毁营地！,洞窟粉碎者,5552,2152,144254,74906,0,0,11,0,0,805
扎卡利废墟已经充斥着敌对的野生动物。清理这里，好让研究员进行调查。,被占领的纪念碑,5553,2152,144256,74906,0,0,12,0,0,805
帮助塞林修复上古扎卡利石柱。,高耸石柱,5554,2152,144258,74906,0,0,13,0,0,805
塞林准备元素仪式期间，赶走这里的岩浆爪。,为石柱供能,5555,2152,144263,74906,0,0,14,0,0,789
击败凶暴的岩浆爪钳兽，保护塞林！,巨型岩浆爪,5556,2152,144265,74906,0,0,15,0,0,805
协助塞林修理扎卡利祭坛。,辅祭,5557,2152,144267,74906,0,0,16,0,0,805
击退扎卡利贾拉丁，保护研究员！,贾拉丁洪流,5558,2152,144270,74906,0,0,17,0,0,805
一名扎卡利仪式大师靠近了祭坛，阻止她，不能让她发泄怒火。,热力迸发,5559,2152,144272,74906,0,0,18,0,0,805
"有个被困在洞穴里10,000年的泰坦守护者受到了污染。",抑制破缺,5560,2152,144297,74906,0,0,5,0,0,756
毁灭奈萨里奥制作的各个版本的危险的龙希尔。,被遗弃的造物,5561,2193,144315,0,0,0,0,0,0,0
击败莱修克，别让他摧毁熔炉。,巨人之怒,5562,2194,144319,0,0,0,0,0,0,0
挫败奈萨里奥的阴谋，阻止他散播黑暗。,奈萨里奥之影,5563,2195,144341,0,0,0,0,0,0,0
阻止萨卡雷斯，不能让他占领亚贝鲁斯。,虚空之缘,5564,2196,144344,0,0,0,0,0,0,0
找到特殊的蜡烛来解锁大门,找到蜡烛打开门扉,5577,2208,144656,0,0,0,0,0,0,0
插入蜡烛打开门扉,插入蜡烛,5578,2208,144659,0,0,0,1,0,0,0
,击败最终首领,5579,2208,144662,0,0,0,2,0,0,0
再测一次！！,第3阶段,5595,2034,146208,0,0,0,2,0,0,0
与索莉多米谈一谈，并让她知道你可以帮忙。,报告,5596,2222,144583,0,0,0,0,8,0,792
,想办法进入战斗竞技场,5623,2246,146258,0,0,0,0,0,0,842
,金币收集者挑战,5624,2246,146262,0,0,0,1,0,0,842
test,第1步,5625,2034,156556,0,0,0,0,16,0,0
,击败阿拉索双子,5632,2246,146297,0,0,0,2,0,0,0
,调查命案,5645,2246,146305,0,0,0,3,0,0,0
Test,Test!,5647,2258,0,0,0,0,0,0,0,0
食用美梦果，获得特殊能力，从而为旅程做好准备。,大树崛起,5648,2259,147022,0,0,0,0,4,0,1002
在杉冠前行的路上帮助渴求雨水的花朵。,梦境汇聚,5649,2259,146455,78866,0,0,1,0,0,856
击败威胁世界树的拜荒者。,青春愚行,5653,2259,146446,78867,0,0,2,0,0,980
对付啃瑞托鱼人法师。,啃瑞托！,5654,2222,144598,76985,0,0,2,0,0,792
对付渔情七处鱼人刺客。,渔情七处！,5655,2222,144602,76985,0,0,3,0,0,792
对付塞呐栗嗷咦会鱼人德鲁伊。,塞呐栗嗷咦会！,5656,2222,144604,76985,0,0,4,0,0,792
对付来自奥达拉斯的恐龙。,奥达拉斯恐龙,5657,2222,144606,76985,0,0,21,0,0,792
对付来自奥达拉斯的植物。,奥达拉斯植物,5658,2222,144608,76985,0,0,22,0,0,792
对付来自奥达拉斯的野兽。,奥达拉斯野兽,5659,2222,144610,76985,0,0,23,0,0,792
消灭格罗姆姆·地勒勒尔。,组队任务：格罗姆姆·地勒勒尔,5660,2222,144635,76983,0,0,5,0,0,792
收集材料构建悚心鱼。,悚心鱼部件,5661,2222,144920,76983,0,0,6,0,0,792
进入水库中心位置的时光裂隙。,遁入裂隙：艾鱼拉斯！,5662,2222,146301,0,0,0,142,0,0,864
击败从时光裂隙里出现的所有生物！,格杀勿论！,5664,2222,144723,76985,0,0,1,0,0,792
消灭鳍利丹。,组队任务：鳍利丹,5665,2222,144906,76983,0,0,7,0,0,792
消灭死亡之伊鲁古勒的爪牙。,组队任务：死亡之伊鲁古勒的爪牙,5666,2222,144908,76983,0,0,8,0,0,792
把惊恐的鱼人宝宝丢回他们所属的维度。,组队任务：惊恐的鱼人宝宝,5667,2222,145179,76983,0,0,9,0,0,792
把游荡的鱼人宝宝丢回他们所属的世界。,组队任务：游荡的鱼人宝宝,5668,2222,145219,76983,0,0,10,0,0,792
把巨蛋拖回传送门。,组队任务：巨蛋,5672,2222,145288,76983,0,0,11,0,0,792
戳破艾鱼拉斯泡士的泡泡。,组队任务：泡泡,5673,2222,145483,0,0,0,12,0,0,792
击败艾鱼拉斯泡士。,组队任务：艾鱼拉斯泡士,5674,2222,145561,76983,0,0,13,0,0,792
摧毁一堆臭熏熏的死鱼。,一堆臭熏熏的死鱼,5675,2222,145329,76984,0,0,14,0,0,792
摧毁一小桶臭熏熏的死鱼。,一小桶臭熏熏的死鱼,5676,2222,145331,76984,0,0,15,0,0,792
摧毁一大桶臭熏熏的死鱼。,一大桶臭熏熏的死鱼,5677,2222,145333,76984,0,0,16,0,0,792
治疗在战场上负伤的鱼人。,负伤的鱼人,5678,2222,145428,76984,0,0,17,0,0,792
治疗在战场上受伤的鱼人。,受伤的鱼人,5679,2222,145473,76984,0,0,18,0,0,792
收集艾鱼拉斯粘液球。,收集粘液,5680,2222,145611,0,0,0,19,0,0,792
打造一个艾鱼拉斯粘液池供你和你的盟友使用。,粘液池工事,5681,2222,145678,76984,0,0,20,0,0,792
消灭纯血云端翔龙。,组队任务：纯血云端翔龙,5682,2222,146101,76983,0,0,24,0,0,792
消灭纯血猛犸。,组队任务：纯血猛犸,5683,2222,146103,76983,0,0,25,0,0,792
消灭纯血始祖幼龙。,组队任务：纯血始祖幼龙,5684,2222,146105,76983,0,0,26,0,0,792
消灭纯血魔暴龙。,组队任务：纯血魔暴龙,5685,2222,146107,76983,0,0,27,0,0,792
摧毁脏污净化器。,组队任务：脏污净化器,5686,2222,146128,76983,0,0,28,0,0,792
踩死袭击索莉多米的平台的恼人野兽。,组队任务：恼人野兽,5687,2222,146130,76983,0,0,29,0,0,792
飞过空中的纯洁的水晶萤。,组队任务：纯洁的水晶萤,5688,2222,146134,76983,0,0,30,0,0,792
解救被缠绕的雏龙。,被缠绕的雏龙,5689,2222,146109,76984,0,0,31,0,0,792
摧毁未被污染的鞭笞者。,未被污染的鞭笞者,5690,2222,146111,76984,0,0,32,0,0,792
找到并消灭顶级迅猛龙。,顶级迅猛龙,5691,2222,146113,76984,0,0,33,0,0,792
找到并消灭顶级猛虎。,顶级猛虎,5692,2222,146115,76984,0,0,34,0,0,792
收集材料建造净化熔炉。,变异人人有,5693,2222,146117,0,0,0,35,0,0,792
将顶级翼手龙从天空中击落。,盘旋末日,5694,2222,146119,0,0,0,36,0,0,792
消灭顶级翼手龙。,顶级翼手龙,5695,2222,146122,76984,0,0,37,0,0,792
修理受伤的看护者。,受伤的看护者,5696,2222,146124,76984,0,0,38,0,0,792
在杉冠继续旅行的同时，拔除杂草。,入侵物种,5699,2259,147016,78868,0,0,3,0,0,866
威拉恩·碎木在向世界之树进军，想烧掉杉冠。击败她！,炽火末路,5700,2259,147032,78203,0,0,8,0,0,983
杉冠漫游时，挖出肥料。,播种混沌,5701,2259,147067,78871,0,0,6,0,0,868
拜荒者聚集在世界树前。守护它！,忧虑滋长,5702,2259,147059,78870,0,0,5,0,0,982
杉冠继续行走的同时，驱赶虫群。,除虫巡逻,5703,2259,147056,78869,0,0,4,0,0,867
对付亡灵。,缓行进攻者,5706,2222,146855,76985,0,0,39,0,0,792
对付蛛魔。,虫害控制,5707,2222,146856,76985,0,0,40,0,0,792
对付瓦古。,为王效力,5708,2222,146857,76985,0,0,41,0,0,792
摧毁天灾谷物。,净化的召唤,5709,2222,146858,76984,0,0,42,0,0,792
处理食血者的尸体。,送别大体老师,5710,2222,146859,76984,0,0,43,0,0,792
摧毁克尔苏加德之书。,最后的图书管理员,5711,2222,146860,76984,0,0,44,0,0,792
把冰冻之心踢进时光裂隙。,遗忘深渊,5712,2222,146861,76984,0,0,45,0,0,792
击败腐烂的角斗士。,勇气竞技场,5713,2222,146862,76984,0,0,46,0,0,792
把腐烂的巨像送回所它处的时间。,冰冻者诞生,5714,2222,146863,76984,0,0,47,0,0,792
把幼年瓦格里送回它所处的时间。,幽灵精魂,5715,2222,146864,76984,0,0,48,0,0,792
解救伯瓦尔·弗塔根。,从未为王,5716,2222,146865,76984,0,0,49,0,0,792
调查冻结的时光裂隙。,组队任务：为王效力,5717,2222,146866,76983,0,0,50,0,0,792
击败受缚的背叛者之焰。,组队任务：白骨庭院,5718,2222,146867,76983,0,0,51,0,0,792
击败女妖之王。,组队任务：总有个风行者,5719,2222,146868,76983,0,0,52,0,0,792
击败死亡使者乌瑟尔。,组队任务：最后的圣骑士,5720,2222,146869,76983,0,0,53,0,0,792
摧毁狂热者的护命匣。,组队任务：突袭圣光,5721,2222,146870,76983,0,0,54,0,0,792
击败萨萨里安领主。,组队任务：亵渎者之殁,5722,2222,146871,76983,0,0,55,0,0,792
击败安格博达女王。,组队任务：觉醒的女王,5723,2222,146872,76983,0,0,56,0,0,792
击败堕落的虫群领主。,组队任务：空虚的胜利,5724,2222,146873,76983,0,0,57,0,0,792
邪触卡多雷及其卫士正在调查此区域——尽可能多地消灭他们，从而干扰他们的工作。,堕落诸子,5726,2222,146382,76985,0,0,60,0,0,792
一队舒哈鲁及其卫士正在用邪能腐化环境——尽可能多地消灭他们。,误入歧途,5727,2222,147014,76985,0,0,58,0,0,792
一队邪能熊怪及其卫士正在用邪能腐化我们的土地——尽可能多地消灭他们。,堕落卫士,5728,2222,147020,76985,0,0,59,0,0,792
消灭邪触卡多雷。,月神的泪水,5729,2222,146840,76984,0,0,61,0,0,792
消灭污染者邪皮。,大地亵渎者,5730,2222,147160,76984,0,0,62,0,0,792
寻找并消灭屠戮者。,屠戮屠戮者,5731,2222,147162,76984,0,0,63,0,0,792
摧毁邪能晶塔，破坏燃烧军团的混乱之网。,网络崩溃,5732,2222,147164,76984,0,0,64,0,0,792
拔出邪能球茎。,球茎拔除,5733,2222,147232,76984,0,0,65,0,0,792
移除军团控制台核心。,核心问题,5734,2222,147239,76984,0,0,66,0,0,792
收集四个邪能松果。,请勿食用,5735,2222,147246,0,0,0,67,0,0,792
将邪能松果塞进灭绝者火炮的排风口。,管道堵塞,5736,2222,147395,76984,0,0,68,0,0,792
消灭库鲁尔的仆从。,组队任务：库鲁尔的仆从,5737,2222,146963,76983,0,0,69,0,0,792
消灭毁灭者乌索克。,组队任务：毁灭者乌索克,5738,2222,146965,76983,0,0,70,0,0,792
消灭邪能看护者玛拉。,组队任务：监视看护者,5739,2222,146968,76983,0,0,71,0,0,792
摧毁邪能散播器。,组队任务：阻止扩散,5740,2222,146874,76983,0,0,72,0,0,792
消灭入侵的地狱火。,组队任务：毁灭边缘,5741,2222,146940,76983,0,0,73,0,0,792
拔出巨大的邪能球茎。,组队任务：邪能大地,5742,2222,147236,76983,0,0,74,0,0,792
对付食虚者。,食虚者,5745,2222,146896,76985,0,0,75,0,0,792
对付亚基虫族。,亚基入侵。,5746,2222,146897,76985,0,0,76,0,0,792
对付卡拉克西。,卡拉克西狂热者,5747,2222,146898,76985,0,0,77,0,0,792
驱散恩佐斯的幻象。,被诅咒的幻象,5749,2222,146900,76984,0,0,78,0,0,792
找到并消灭先知斯基特拉。,先知斯基特拉,5750,2222,146901,76984,0,0,79,0,0,792
找到并消灭皇家宰相佐尔洛克。,皇家宰相佐尔洛克,5751,2222,146902,76984,0,0,80,0,0,792
踩扁孳生肿瘤,扩散孳生,5752,2222,146903,76984,0,0,81,0,0,792
摧毁亚基之卵。,亚基之卵,5753,2222,146904,76984,0,0,82,0,0,792
摧毁卡拉克西孵化室。,卡拉克西孵化室,5754,2222,146905,76984,0,0,83,0,0,792
把卡拉克西飞虫囚禁在琥珀监牢里。,琥珀打造的囚牢,5755,2222,146906,76984,0,0,84,0,0,792
与恩佐斯之触的触须作战。,组队任务：击败腐蚀,5756,2222,146907,76983,0,0,85,0,0,792
飞翔并用你的幼龙撞击游离观察者。,组队任务：净除空域,5757,2222,146908,76983,0,0,86,0,0,792
用棍子去捅恩佐斯之眼。,组队任务：眼中尖钉,5758,2222,146909,76983,0,0,87,0,0,792
摧毁虚空囚笼。,组队任务：虚空囚笼,5759,2222,146910,76983,0,0,88,0,0,792
消灭暮光预言者古加尔。,组队任务：暮光预言者古加尔,5760,2222,146911,76983,0,0,89,0,0,792
消灭食虚者夏德哈。,组队任务：食虚者夏德哈,5761,2222,146912,76983,0,0,90,0,0,792
消灭腐化的德阿佳丝。,组队任务：腐化的德阿佳丝,5762,2222,146913,76983,0,0,91,0,0,792
消灭至尊将军帕瓦拉克。,组队任务：至尊将军帕瓦拉克,5763,2222,146914,76983,0,0,92,0,0,792
击败尽可能多的卓越荣耀联盟入侵成员。,卓越荣耀联盟,5764,2222,146915,76985,0,0,93,0,0,792
击败尽可能多的卓越荣耀联盟和鲜血部落的交战成员。,永恒战争,5765,2222,146916,76985,0,0,94,0,0,792
击败尽可能多的鲜血部落入侵成员。,鲜血部落,5766,2222,146917,76985,0,0,95,0,0,792
找到并消灭剔骨者金塔拉。,剔骨者金塔拉,5767,2222,146918,76984,0,0,96,0,0,792
找到并消灭战斗法师博南特。,战斗法师博南特,5768,2222,146919,76984,0,0,97,0,0,792
浪费卓越荣耀联盟的炮弹储备。,弹药耗尽,5769,2222,146920,76984,0,0,98,0,0,792
提前引爆鲜血部落的废铁炸弹。,炸翻天,5770,2222,146924,76984,0,0,99,0,0,792
建造一个鲜血部落枪械架以供你和你的盟友使用。,鲜血部落枪械,5771,2222,146925,76984,0,0,101,0,0,792
建造一个卓越荣耀联盟枪械架以供你和你的盟友使用。,卓越荣耀联盟枪械,5772,2222,146926,76984,0,0,103,0,0,792
偷取尘霸并将其驶回索莉多米身边。,尘霸,5773,2222,146927,76984,0,0,104,0,0,792
偷取飞行器并将其开回索莉多米身边。,飞行器,5774,2222,146928,76984,0,0,105,0,0,792
消灭安库拉·血劈。,组队任务：安库拉·血劈,5775,2222,146929,76983,0,0,106,0,0,792
消灭天空指挥官加迪乌斯·奥克贝恩。,组队任务：天空指挥官加迪乌斯·奥克贝恩,5776,2222,146930,76983,0,0,107,0,0,792
消灭烟鬼玛格什。,组队任务：烟鬼玛格什,5777,2222,146931,76983,0,0,108,0,0,792
消灭大审讯官基兰德勒。,组队任务：大审讯官基兰德勒,5778,2222,146932,76983,0,0,109,0,0,792
将巨型炸弹拉回它应存在的现实。,组队任务：巨型炸弹！,5779,2222,146933,76983,0,0,110,0,0,792
拆除鲜血地雷。,组队任务：鲜血部落雷区,5780,2222,146934,76983,0,0,111,0,0,792
冲破蒙福审判官的护盾，然后击败蒙福审判官。,组队任务：蒙福审判官,5781,2222,146935,76983,0,0,112,0,0,792
