Description_lang,Title_lang,ID,ScenarioID,CriteriatreeID,RewardQuestID,RelatedStep,Supersedes,OrderIndex,Flags,VisibilityPlayerConditionID,WidgetSetID
调查第二个艾泽里特之源。,还有更多,3825,1570,66695,0,0,0,2,0,0,0
消灭硬壳弑君蟹。,硬壳弑君蟹,3826,1570,66696,0,0,0,3,0,0,0
调查第三个艾泽里特之源。,接踵而至,3827,1570,66697,0,0,0,4,0,0,0
从昆森猢狲部族取得艾泽里特。,争夺艾泽里特,3828,1570,66698,0,0,0,5,0,0,0
赶在联盟部队到达之前撤离神秘海岛。,撤离！,3829,1570,66699,0,0,0,6,0,0,0
在黑石深渊的黑铁砧处与茉艾拉、塞林与索加登见面。,黑铁砧,3830,1571,66731,0,0,0,0,0,0,0
调查艾泽里特之源。,调查艾泽里特,3838,1573,66737,0,0,0,0,0,0,0
开采艾泽里特结晶。,丰富矿藏,3839,1573,66739,0,0,0,1,0,0,0
调查第二个艾泽里特之源。,还有更多,3840,1573,66741,0,0,0,2,0,0,0
消灭硬壳弑君蟹。,硬壳弑君蟹,3841,1573,66743,0,0,0,3,0,0,0
调查第三个艾泽里特之源。,接踵而至,3842,1573,66745,0,0,0,4,0,0,0
从昆森猢狲部族取得艾泽里特。,争夺艾泽里特,3843,1573,66747,0,0,0,5,0,0,0
赶在部落部队到达之前撤离神秘海岛。,撤离！,3844,1573,66749,0,0,0,6,0,0,0
把艾泽里特放到黑铁砧上。,一点艾泽里特,3847,1571,66828,0,0,0,1,0,0,0
保护铁砧守卫索加登和塞林·暗砧塑造艾泽里特。,塑造艾泽里特,3848,1571,66826,0,0,0,2,0,0,0
等待茉艾拉·索瑞森的指令。,工序熔渣,3849,1571,66855,0,0,0,3,0,0,0
地精在攻击我们！把灼天者干掉。,灼烧天空,3850,1571,66853,0,0,0,4,0,0,0
保卫黑铁大道。,黑铁大道,3851,1571,66863,0,0,0,5,0,0,0
击败瑞克莎·流火。,流火威胁,3852,1571,66866,0,0,0,6,0,0,0
回黑铁砧处与黑铁矮人见面。,铁砧重锤,3853,1571,66868,0,0,0,7,0,0,0
吉安娜逃入了枯败之界更深处。跟着她。,追逐暗影,3854,1551,66817,0,0,0,1,0,0,0
找到吉安娜的镜像，她们藏在枯败之界的许多地方。,捉迷藏,3855,1551,66819,0,0,0,2,0,0,0
跟随戴林的声音找到吉安娜的真正位置。,进入镜子,3856,1551,66821,0,0,0,3,0,0,0
击败高莱克·图尔，并且从枯败之界逃脱。,面对命运,3857,1551,66823,0,0,0,4,0,0,0
跟随凯瑟琳进入兹洛斯，枯败之界。,枯败之界,3858,1551,66857,0,0,0,0,0,0,0
击败艾什凡女勋爵的部队，阻止敌人毁灭伯拉勒斯。,围攻伯拉勒斯,3966,1685,67227,53623,0,0,0,0,0,0
去援助蛮兽岗哨！光缚者即将对那里发起攻击。,前往蛮兽岗哨,3973,1575,67837,0,0,0,0,0,0,0
守卫蛮兽岗哨，抵御光缚者的攻击。,光缚者,3974,1575,67839,0,0,0,1,0,0,0
找到永晨要塞的大主教欧雷里斯。,永晨要塞,3975,1575,67843,0,0,0,2,0,0,0
击败光缚大主教。,大主教欧雷里斯,3976,1575,67845,0,0,0,3,0,0,0
去蛮兽岗哨找格罗玛什·地狱咆哮。,向大酋长回报,3977,1575,67847,0,0,0,4,0,0,0
使用蛮兽岗哨塔楼顶部的炮台守卫玛格汉兽人。,蛮兽岗哨塔楼防御战,3978,1575,67849,0,0,0,6,0,0,0
与伊崔格和玛格汉兽人一起逃离德拉诺。,险境求生,3979,1575,67851,0,0,0,8,0,0,0
等待格罗玛什的指令。,格罗玛什的指令,3980,1575,68019,0,0,0,5,0,0,0
去蛮兽岗哨找地狱咆哮大酋长。,向大酋长回报,3981,1575,68021,0,0,0,7,0,0,0
靠近守桥者。,守桥者,3982,1691,68814,0,0,0,0,0,0,0
击败邪教徒及其盟友。,拉格纳罗斯教派,3983,1691,68816,0,0,0,1,0,0,0
击败裁决者格里斯通。,拉格纳罗斯的使徒,3984,1691,68843,0,0,0,3,0,0,0
靠近熔岩池，把拉格纳罗斯的力量灌注进熔火之心。,拉格纳罗斯之力,3985,1691,68845,0,0,0,4,0,0,0
面对裁决者格里斯通。,格里斯通,3986,1691,68847,0,0,0,2,0,0,0
清除被遗忘者在奥伯丁废墟的威胁。,为了奥伯丁！,3992,1697,71584,0,0,0,1,0,0,457
击败敌方将领并为联盟夺回黑海岸。,月之降临,3993,1697,70787,53800,0,0,10,0,0,457
为联盟夺回巴莎兰。,夺回巴莎兰,3994,1697,70815,0,0,0,6,0,0,457
建造必要的单位来击败敌人。,挺进战线,3996,1697,71122,0,0,0,8,0,0,457
点亮灯笼，开始亡者的回忆。,以血之名,3999,1699,71272,0,0,0,0,0,0,0
坚守阵地，抵御天灾军团,背水一战,4000,1699,71274,0,0,0,1,0,0,0
击败先知丹尼克斯,阻止死亡远征,4001,1699,71276,0,0,0,2,0,0,0
面对阿尔萨斯。,为了安纳斯特里亚！,4002,1699,71282,0,0,0,3,0,0,0
突破障碍，前往太阳之井。,逐日行者,4003,1699,71284,0,0,0,5,0,0,0
在仪式中保护魔导师。,王子的决定,4004,1699,71286,0,0,0,6,0,0,0
乘坐划艇前往奥伯丁废墟。,泰达希尔之殇,4006,1700,71338,0,0,0,0,0,0,0
帮助玛维和珊蒂斯在奥伯丁废墟寻找艾露恩之眼。,艾露恩的凝视,4007,1700,71408,0,0,0,1,0,0,0
击败胆肠并在瘟疫中幸存下来！,突破重围！,4008,1700,71412,0,0,0,2,0,0,0
调查附近的尖叫声。,呼救之音,4009,1700,71414,0,0,0,3,0,0,0
在巴莎兰找到泰兰德·语风。,步步逼近,4010,1700,71416,0,0,0,5,0,0,0
保卫巴莎兰，并帮助泰兰德完成月夜战神仪式。,光耀万物,4011,1700,71418,0,0,0,6,0,0,0
追上纳萨诺斯·凋零者。,无处可逃,4012,1700,71420,0,0,0,8,0,0,0
与纳萨诺斯·凋零者对峙。,女王的棋卒,4013,1700,71422,0,0,0,10,0,0,0
回到舰队并侦察部落军队。,森林之眼,4014,1700,71424,0,0,0,11,0,0,0
清除奥伯丁废墟的卡多雷势力。,净化废墟,4015,1701,71426,0,0,0,1,0,0,157
为部落夺回巴莎兰。,立足之地,4017,1701,71439,0,0,0,6,0,0,157
建造必要的单位来击败敌人。,挺进战线,4018,1701,71442,0,0,0,8,0,0,157
击败敌方将领并为部落夺回黑海岸。,前路已尽,4019,1701,71446,53801,0,0,10,0,0,157
救出枯萎林地的卡多雷俘虏。,一个都不能少,4020,1700,71477,0,0,0,4,0,0,0
肃清出口。,简单计划,4021,1702,71507,0,0,0,0,0,0,0
进入珍宝间。,靠谱的任务,4022,1702,71588,0,0,0,1,0,0,0
进入中央大厅。,选择捷径,4023,1702,71610,0,0,0,2,0,0,0
回到外部门厅。,为时不晚,4024,1702,71640,0,0,0,3,0,0,0
完成泰兰德晋升为月夜战神的仪式。,月夜战神,4025,1700,71511,0,0,0,7,0,0,0
诺莫瑞根自动防御已激活！,自动防御,4026,1703,71522,0,0,0,0,0,0,0
击败活体元素。,脱缰的元素,4027,1703,71591,0,0,0,1,0,0,0
通过正确的拉杆顺序来激活大门控制台。,激活大门控制台,4028,1703,71595,0,0,0,2,0,0,0
,面对巫妖王,4029,1704,71558,0,0,0,0,0,0,0
撤退到邦桑迪的死亡之门。,抵达死亡之门,4030,1704,71560,0,0,0,1,0,0,0
使用邦桑迪的死亡之门逃离冰封王座。,逃离冰封王座,4031,1704,71562,0,0,0,2,0,0,0
在附近找到纳萨诺斯·凋零者。,无处可藏,4032,1700,71564,0,0,0,9,0,0,0
交付这样一名重要的囚犯可以打开许多扇门。,交付囚犯,4033,1705,71597,0,0,0,0,0,0,0
在奥伯丁废墟击败部落的前线指挥官。,施加压力,4034,1697,70785,0,0,0,2,0,0,457
使守卫因为某件事而离开，然后取得万能钥匙。,进去的路,4035,1705,71620,0,0,0,1,0,0,0
大酋长希尔瓦娜斯需要这名囚犯。,释放普里西拉·艾什凡,4036,1705,71631,0,0,0,2,0,0,0
释放囚犯。他们会引开守卫。,干扰守卫,4037,1705,71626,0,0,0,3,0,0,0
狱长阿米卡尔和他的士兵是最后一关了。只要击败他们，自由之路就畅通无阻了。,背水一战,4038,1705,71633,0,0,0,5,0,0,0
点亮灯笼，了解凯尔萨斯的决定。,小小的挫折,4039,1699,71612,0,0,0,4,0,0,0
骑乘碎弹者5000型穿过一片致命的炸弹机器人。,穿过雷区,4040,1703,71622,0,0,0,3,0,0,0
击败在这里幸存下来的小动物。,坚韧的小动物,4041,1703,71599,0,0,0,4,0,0,0
有只大得出奇的麻风鼠，它守住了门口，而且看起来很不友善。,你这只肮脏的老鼠,4042,1703,71602,0,0,0,5,0,0,0
战胜诺莫瑞根防御系统。,诺莫瑞根防御系统，启动！,4043,1703,71604,0,0,0,6,0,0,0
机械师瑟玛普拉格把他最新的发明留在了这里，作为守护诺莫瑞根的最后堡垒。干掉它！,瑟玛普拉格最新的发明,4044,1703,71608,0,0,0,8,0,0,0
黑暗女王正在静待佳音。,前往船上,4045,1705,71979,0,0,0,6,0,0,0
击败珍宝间哨卫。,越大就越……,4046,1702,71686,0,0,0,4,0,0,0
在排水道安放炸药来阻止追兵。,脱狱,4047,1705,71651,0,0,0,4,0,0,0
进入珍宝间。,继续搜寻,4048,1702,71675,0,0,0,5,0,0,0
有人传送进了房间！战胜他们！,阴暗的人影,4049,1703,71655,0,0,0,7,0,0,0
准备作战。,战斗准备,4050,1697,71677,0,0,0,0,0,0,457
击败珍宝间守卫。,面具危险,4051,1702,72400,0,0,0,6,0,0,0
处于险境之中。,还有陷阱？开玩笑呢？,4052,1702,71696,0,0,0,7,0,0,0
拯救守护古树。,保护古树,4053,1697,71688,0,0,0,3,0,0,457
击败巴莎兰的荒芜卫士队长塞德利克。,终结存在,4054,1697,71694,0,0,0,5,0,0,457
在肖尔解除陷阱期间保护他。,周密防护,4055,1702,71700,0,0,0,8,0,0,0
跟马迪亚斯·肖尔商量一下。,掉包。,4056,1702,71709,0,0,0,9,0,0,0
与你的指挥官并肩作战，杀出一条通向巴莎兰的路。,势如破竹,4058,1697,71715,0,0,0,4,0,0,457
拓展你在巴莎兰的基地。,扎根,4059,1697,72004,0,0,0,7,0,0,457
清除洛达内尔登陆点的剩余部落威胁。,北方海岸,4060,1697,72007,0,0,0,9,0,0,457
准备作战。,战斗准备,4077,1701,72096,0,0,0,0,0,0,157
在奥伯丁废墟击败联盟的前线指挥官。,向着前线进发,4078,1701,72068,0,0,0,2,0,0,157
从铁枝德鲁伊手中拯救大药剂师法拉尼尔和死亡猎手指挥官贝尔蒙特。,清除缠藤,4079,1701,72070,0,0,0,3,0,0,157
与你的指挥官并肩作战，杀出一条通向巴莎兰的路。,向前进军,4080,1701,72072,0,0,0,4,0,0,157
击败巴莎兰的大德鲁伊安得列留斯。,击溃抵抗者,4081,1701,72074,0,0,0,5,0,0,157
拓展你在巴莎兰的基地。,强化行动,4082,1701,72076,0,0,0,7,0,0,157
清除洛达内尔登陆点的剩余联盟威胁。,北方海岸,4083,1701,72098,0,0,0,9,0,0,157
跟随贝恩和灵魂行者前往远眺台地。,追寻灵魂,4084,1711,73501,0,0,0,0,0,0,0
灵魂伏击了你们，进攻！,击败堕落之灵,4085,1711,75510,0,0,0,1,0,0,0
有只堕落之灵逃跑了，不过阿库勒能追踪它。,正在追踪……,4087,1711,75350,0,0,0,2,0,0,0
查看先祖之魂，寻找堕落的迹象。,是敌是友,4095,1711,75326,0,0,0,3,0,0,0
拯救灵魂，寻求力量，击败典狱长的部队。,攀登高塔,4096,1712,75401,0,0,0,0,0,0,291
拉斯塔哈的大部分兵力被引到了纳兹米尔，现在是突袭达萨罗的大好时机。,围攻达萨罗,4097,1713,75409,0,0,0,0,0,0,0
Defeat the Vision Guardians. [DNT],遁入疯狂,4102,1710,78335,0,0,0,0,0,0,0
王宫的大厅内存放着上古珍宝，但要小心守护此地的洛阿神灵之怒。,帝国的末日,4103,1714,75485,0,0,0,0,0,0,0
见证部落攻击联盟英雄的残忍暴行。,联盟之力,4104,1715,75489,0,0,0,0,0,0,0
达萨罗被卑鄙的联盟偷袭，部落无畏的勇士是杀出重围的唯一希望。,达萨罗保卫战,4105,1716,75493,0,0,0,0,0,0,0
见证拉斯塔哈大王是如何英勇地抵抗嗜血的联盟入侵者。,死神的契约,4107,1718,75497,0,0,0,0,0,0,0
拉斯塔哈大王遇刺，必须在凶手逃走前将他们绳之以法。,不胜利，毋宁死,4108,1719,75501,0,0,0,0,0,0,0
继续追踪怨恨之灵。,前往区域3,4109,1711,75508,0,0,0,4,0,0,0
面对怨恨之灵。,直面恐惧,4110,1711,75519,0,0,0,5,0,0,0
跟随并消灭怨恨之灵。,最后的对峙,4111,1711,78290,0,0,0,6,0,0,0
击败怨恨之灵。,痛苦的回忆,4112,1711,78292,0,0,0,7,0,0,0
与凯恩和贝恩同行。,凯恩的恳谈,4113,1711,78294,0,0,0,8,0,0,0
与灵魂行者乌索交谈并回家。,逝者已矣,4114,1711,78298,0,0,0,9,0,0,0
Slay Faceless Adherents to weaken N'Zoth. [DNT],击败追随者,4115,1710,78343,0,0,0,1,0,0,0
Collect the Vision Scrolls to better understand N'Zoth's plans. [DNT],幻象卷轴,4116,1710,78345,0,0,0,2,0,0,0
Defeat the disciple of N'Zoth. [DNT],消灭信徒,4117,1710,78347,54986,0,0,5,0,0,0
Find and escort out the injured Seeker. [DNT],营救探求者,4118,1710,78349,0,0,0,3,0,0,0
"Seekers are performing a disruption ritual, they must be defended. [DNT]",保护探求者,4119,1710,78351,0,0,0,4,0,0,0
重建并激活开垦钻机。,重建开垦钻机,4125,1720,78602,0,0,0,0,0,0,0
抵挡攻击，保卫开垦设备。,保卫开垦钻机,4126,1720,78619,0,0,0,1,0,0,0
玩“别叫醒纳拉雷克斯”。,别叫醒纳拉雷克斯,4127,1721,78632,0,0,0,0,0,0,0
找出声音的源头。,一声悲鸣,4128,1721,78638,0,0,0,1,0,0,0
击败中子激潮,击败中子激潮,4129,1720,78718,55148,0,0,2,4,0,0
击败淤泥喷射者“制造”的碎泥。,那是它吐出来的吗？,4131,1724,78720,0,0,0,0,0,0,0
让亚瑟讲故事。,不同的视角,4134,1721,79053,0,0,0,2,0,0,0
击败不稳定的辐射魔像,击败不稳定的辐射魔像,4136,1720,79057,55794,0,0,2,4,0,0
看看是否有人对谋杀案知情。,德鲁伊调查,4137,1721,79066,0,0,0,3,0,0,0
使用你的感官寻找线索。,闻嗅地面,4138,1721,79093,0,0,0,4,0,0,0
击败朱红庇护所的折虚进攻者。,朱红保卫战,4156,1729,79332,0,0,0,0,0,0,0
与朱红庇护所的阿莱克丝塔萨交谈。,生命的缚誓者,4158,1729,79338,0,0,0,1,0,0,0
与格瑞姆巴托的维克修娜对峙。,来自暗影,4160,1729,79342,0,0,0,4,0,0,0
希萨莉有线索了！去看看她发现了什么。,跟随踪迹,4161,1721,79348,0,0,0,5,0,0,0
找出凶手，将他绳之以法！,恶毒的凶手,4162,1721,79351,0,0,0,6,0,0,0
与拉希奥的影像对话。,陷落之城,4170,1731,79386,0,0,0,0,0,0,458
消灭恩佐斯的信徒。,消灭信徒,4171,1731,79388,0,0,0,1,0,0,458
与拉希奥的影像对话。,进入奥格瑞玛,4172,1733,79371,0,0,0,0,0,0,244
消灭恩佐斯的信徒。,消灭信徒,4173,1733,79384,0,0,0,1,0,0,244
通过通道尽头的守卫。,好戏开始,4183,1734,79405,0,0,0,0,0,0,0
避开守卫，与萨尔和萨鲁法尔一起穿过房间。,眼皮底下,4184,1734,79407,0,0,0,1,0,0,0
骑上朱红庇护所上层的卡雷苟斯。,直冲云霄！,4185,1729,79340,0,0,0,3,0,0,0
唤醒苔丝,猎人之心,4186,1732,79409,0,0,0,0,0,0,0
击败攻击吉尔尼斯的被遗忘者。,梦境起点,4187,1732,79411,0,0,0,1,0,0,0
消灭黑暗游侠西亚拉。,兽群领袖,4188,1732,79413,0,0,0,2,0,0,0
追踪纳萨诺斯·凋零者。,凋零的元凶,4189,1732,79415,0,0,0,3,0,0,0
消灭纳萨诺斯,野性之怒,4190,1732,79417,0,0,0,4,0,0,0
苔丝已经往城镇广场跑去。追上她！,追逐梦魇,4191,1732,79419,0,0,0,5,0,0,0
击败狂怒精华。,月光审判,4192,1732,79421,0,0,0,6,0,0,0
与萨尔商量一个计划。,出谋划策,4193,1734,79425,0,0,0,2,0,0,0
挑战精英部落战士以引开注意。,出战！,4194,1734,79477,0,0,0,3,0,0,0
在格里恩囚犯的灵魂被吸干之前，拯救他们！,拯救囚犯,4198,1712,79471,0,0,0,2,1,69140,0
与萨尔和萨鲁法尔会和，继续深入此地。,不可能的盟友,4200,1734,79481,0,0,0,5,0,0,0
表现出你会不惜一切代价营救贝恩。,休战与后果,4201,1734,79488,0,0,0,6,0,0,0
深入斯托颂谷地下方的密室，探寻蔓延于这片土地的暗影之源。,风暴熔炉,4202,1735,79483,0,0,0,0,0,0,0
击败强大的敌人！,强力劲敌,4204,1712,81438,0,0,0,3,1,69189,0
击败洛娃·血击。,击垮他们！,4206,1734,79524,0,0,0,7,0,0,0
去见贝恩·血蹄。,查看贝恩·血蹄,4207,1734,79526,0,0,0,8,0,0,0
保护贝恩·血蹄，摧毁抑制水晶。,这是个陷阱！,4208,1734,79528,0,0,0,9,0,0,0
使用传送门逃走,目的地：不是这里就行,4209,1734,0,0,0,0,10,0,0,0
跟随乐娜拉，获得最新命令。,我们中间出了叛徒,4210,1734,79717,0,0,0,4,0,0,0
调查奥术棱镜。,不灭精华,4213,1736,79726,0,0,0,0,0,0,0
击败棱镜守卫。,不灭守卫,4214,1736,79728,0,0,0,1,0,0,0
击败永恒异形体,永恒异形体,4215,1736,79732,0,0,0,2,0,0,0
逼退大型硬化锐壳龟。,我们遭到了攻击！,4218,1737,79789,0,0,0,0,0,0,0
跟随大型硬化锐壳龟。,跟随敌人,4219,1737,79791,0,0,0,1,0,0,0
攻击大型硬化锐壳龟。,锐壳龟之战,4220,1737,79793,0,0,0,2,0,0,0
跟随大型硬化锐壳龟前往它的巢穴。,深入巢穴！,4221,1737,79795,0,0,0,3,0,0,0
在巢穴中消灭大型硬化锐壳龟。,消灭大型硬化锐壳龟,4222,1737,79797,0,0,0,4,0,0,0
离开平台。,好戏开始,4223,1738,79819,0,0,0,0,0,0,0
摧毁艾泽里特研究设施内的机甲后离开。,机甲毁灭,4224,1738,79845,0,0,0,2,0,0,0
前往大门。,出口在右,4225,1738,79847,0,0,0,3,0,0,0
在肖尔打开大门时保护他。,后有追兵，前有出口,4226,1738,79851,0,0,0,4,0,0,0
继续深入。,不可能的盟友,4227,1738,79855,0,0,0,5,0,0,0
穿过通道到达下层。,深入奥格瑞玛,4234,1738,79843,0,0,0,1,0,0,0
与部落合作找到贝恩。,休战与后果,4235,1738,79857,0,0,0,6,0,0,0
击败洛娃·血击。,击垮他们！,4236,1738,79860,0,0,0,7,0,0,0
去见贝恩·血蹄。,查看贝恩·血蹄,4237,1738,79862,0,0,0,8,0,0,0
保护贝恩·血蹄，摧毁抑制水晶。,这是个陷阱！,4238,1738,79864,0,0,0,9,0,0,0
使用传送门逃走,目的地：不是这里就行,4239,1738,0,0,0,0,10,0,0,0
通过通道尽头的守卫。,好戏开始,4242,1739,79893,0,0,0,0,0,0,0
避开守卫，与萨尔和萨鲁法尔一起穿过房间。,眼皮底下,4243,1739,79895,0,0,0,1,0,0,0
与萨尔商量一个计划。,出谋划策,4244,1739,79898,0,0,0,2,0,0,0
挑战精英部落战士以引开注意。,出战！,4245,1739,79900,0,0,0,3,0,0,0
检阅部队。,检阅部队,4246,1739,79902,0,0,0,4,0,0,0
与萨尔和萨鲁法尔会和，继续深入此地。,不可能的盟友,4247,1739,79905,0,0,0,5,0,0,0
不惜一切代价拯救贝恩。,休战与后果,4248,1739,79907,0,0,0,6,0,0,0
击败洛娃·血击。,击垮他们！,4249,1739,79910,0,0,0,7,0,0,0
去见贝恩·血蹄。,查看贝恩·血蹄,4250,1739,79912,0,0,0,8,0,0,0
保护贝恩·血蹄，摧毁抑制水晶。,这是个陷阱！,4251,1739,79914,0,0,0,9,0,0,0
使用传送门逃走,目的地：不是这里就行,4252,1739,0,0,0,0,10,0,0,0
击退原始的鸣脊碎石蟹。,我们遭到了攻击！,4260,1741,79966,0,0,0,0,0,0,0
跟随原始的鸣脊碎石蟹。,跟随敌人,4261,1741,79968,0,0,0,1,0,0,0
攻击原始的鸣脊碎石蟹。,碎石之战,4262,1741,79970,0,0,0,2,0,0,0
跟随原始的鸣脊碎石蟹进入它的巢穴。,深入巢穴！,4263,1741,79972,0,0,0,3,0,0,0
在巢穴内消灭原始的鸣脊碎石蟹。,消灭碎石蟹,4264,1741,79974,0,0,0,4,0,0,0
击退毒鳍龙惊怖头领。,我们遭到了攻击！,4265,1742,79976,0,0,0,0,0,0,0
跟随毒鳍龙惊怖头领。,跟随敌人,4266,1742,79978,0,0,0,1,0,0,0
攻击毒鳍龙惊怖头领。,头领之战,4267,1742,79980,0,0,0,2,0,0,0
跟随毒鳍龙惊怖头领前往它的巢穴。,深入巢穴！,4268,1742,79982,0,0,0,3,0,0,0
在巢穴内消灭毒鳍龙惊怖头领。,消灭头领,4269,1742,79984,0,0,0,4,0,0,0
击退硕大的积怨蛇王。,我们遭到了攻击！,4270,1743,79986,0,0,0,0,0,0,0
跟随硕大的积怨蛇王。,跟随敌人,4271,1743,79988,0,0,0,1,0,0,0
攻击硕大的积怨蛇王。,蛇王之战,4272,1743,79990,0,0,0,2,0,0,0
跟随硕大的积怨蛇王前往它的巢穴。,深入巢穴！,4273,1743,79992,0,0,0,3,0,0,0
在巢穴消灭硕大的积怨蛇王。,消灭蛇王,4274,1743,79994,0,0,0,4,0,0,0
击退高耸的洞穴烁壳蟹。,我们遭到了攻击！,4275,1744,79996,0,0,0,0,0,0,0
跟随高耸的洞穴烁壳蟹。,跟随敌人,4276,1744,79998,0,0,0,1,0,0,0
攻击高耸的洞穴烁壳蟹。,烁壳蟹之战,4277,1744,80000,0,0,0,2,0,0,0
跟随高耸的洞穴烁壳蟹前往它的巢穴。,深入巢穴！,4278,1744,80002,0,0,0,3,0,0,0
在巢穴内消灭高耸的洞穴烁壳蟹。,消灭烁壳蟹,4279,1744,80004,0,0,0,4,0,0,0
击退上古海沟滑行者。,我们遭到了攻击！,4280,1745,80006,0,0,0,0,0,0,0
跟随大型硬化锐壳龟。,跟随敌人,4281,1745,80008,0,0,0,1,0,0,0
攻击上古海沟滑行者。,滑行者之战,4282,1745,80010,0,0,0,2,0,0,0
跟随上古海沟滑行者前往它的巢穴。,深入巢穴！,4283,1745,80012,0,0,0,3,0,0,0
在巢穴内消灭上古海沟滑行者。,消灭滑行者,4284,1745,80014,0,0,0,4,0,0,0
击退入侵的堡礁行者。,我们遭到了攻击！,4285,1746,80016,0,0,0,0,0,0,0
跟随入侵的堡礁行者。,跟随敌人,4286,1746,80018,0,0,0,1,0,0,0
攻击入侵的堡礁行者。,堡礁行者之战,4287,1746,80020,0,0,0,2,0,0,0
跟随入侵的堡礁行者前往它的巢穴。,深入巢穴！,4288,1746,80022,0,0,0,3,0,0,0
在巢穴内消灭入侵的堡礁行者。,消灭堡礁行者,4289,1746,80024,0,0,0,4,0,0,0
击退残忍的巨鳗。,我们遭到了攻击！,4290,1747,80026,0,0,0,0,0,0,0
跟随残忍的巨鳗。,跟随敌人,4291,1747,80028,0,0,0,1,0,0,0
攻击残忍的巨鳗。,巨鳗之战,4292,1747,80030,0,0,0,2,0,0,0
跟随残忍的巨鳗前往它的巢穴。,深入巢穴！,4293,1747,80032,0,0,0,3,0,0,0
在巢穴内消灭残忍的巨鳗。,消灭巨鳗,4294,1747,80034,0,0,0,4,0,0,0
纳迦正从深渊召唤一个怪物，消灭他们！,召唤仪式,4307,1754,80054,0,0,0,0,0,0,0
击败召唤出来的怪物。,深渊召唤,4308,1754,80056,56830,0,0,1,4,0,0
艾萨拉亲自召唤并强化了一个怪物，必须消灭它！,强化的怪物,4309,1754,80058,56830,0,0,1,4,0,0
前往起源大厅的内室。,不速之客,4311,1755,80179,0,0,0,0,0,0,0
领导对麦卡贡的突袭。,麦卡贡行动,4312,1756,80185,0,0,0,0,0,0,0
救出朱红庇护所上被腐化的幼龙。,阻止腐化,4313,1729,80196,0,0,0,2,0,0,0
关闭预言之厅的防御系统。,永恒守护,4316,1755,80261,0,0,0,1,0,0,0
击败守护者奥姆-卡，然后启动造物主之阶的升降梯。,构造体的毁灭,4317,1755,80265,0,0,0,3,0,0,0
改变光明穹顶的能量电路的布局，连接到造物主之阶的终端。,上升,4318,1755,80267,0,0,0,5,0,0,0
击败太阳先知滕哈门。,斩断提线,4319,1755,80269,0,0,0,6,0,0,0
乘坐升降梯进入造物主之阶的上层房间，然后重新启动起源熔炉。,起源重启,4320,1755,80305,0,0,0,7,0,0,0
前往造物主之阶的升降梯。,敌对大厅,4321,1755,80263,0,0,0,2,0,0,0
击败淤泥喷射者。,陪它玩玩！,4322,1724,80424,0,0,0,1,0,0,0
击败游荡幻影和地穴恶魔并保卫通灵塔。,恐怖幻影和惊悚恶魔,4323,1724,80426,0,0,0,2,0,0,0
击败讯问者莉兹,受折磨的鬼魂,4324,1724,80431,0,0,0,3,0,0,0
继续深入屠杀广场。,我才不怕鬼,4325,1724,80433,0,0,0,4,0,0,0
击败染疫的小动物！,有埋伏！,4326,1724,80437,0,0,0,5,0,0,0
击败复活的卫兵,亡者世界,4327,1724,80439,0,0,0,6,0,0,0
有个你见过的最矮的通灵师挡在了你面前，阻止他！,小小大恶徒,4328,1724,80441,0,0,0,7,0,0,0
控制淤泥喷射者扫清广场！,掌控混乱,4329,1724,80443,0,0,0,8,0,0,0
进入屠宰房并面对你的最终敌人！,进入屠宰房！,4331,1724,80444,0,0,0,9,0,0,0
阴暗的人影回来了！这下糟了。,暗影归来,4332,1724,80447,0,0,0,10,0,0,0
找到前往魔古山宫殿下层的道路。,往下走,4336,1757,81246,0,0,0,0,0,0,0
激活赤红议事厅中古老的拉杆。,当心脚下,4340,1757,81248,0,0,0,1,0,0,0
找到打开遗忘长廊的封印之门的方法。,沉重的问题,4341,1757,81250,0,0,0,2,0,0,0
从遗忘长廊的秘密通道前往魔古山宝库。,漫长的路程,4342,1757,81252,0,0,0,3,0,0,0
摧毁藏书馆中召唤出来的恩佐斯的具象。,疯狂具象,4343,1757,81254,0,0,0,4,0,0,0
从塑造者大厅的螳螂妖大军中杀出重围，前往纳拉克煞引擎。,塑造者大厅,4344,1757,81256,0,0,0,5,0,0,0
击败纳拉克煞引擎的约克斯伊斯。,最终召唤,4345,1757,81258,0,0,0,6,0,0,0
将纳拉克煞引擎连接到心之秘室。,引擎旋转,4346,1757,81260,0,0,0,7,0,0,0
,调查议政厅,4349,1759,81432,0,0,0,0,0,0,0
,击败巨怪,4350,1759,81434,0,0,0,1,0,0,0
,击败剥夺者,4351,1759,81747,0,0,0,2,0,0,0
,使用心能之流,4352,1759,81845,0,0,0,3,0,0,0
,找到吉安娜的碎片,4353,1759,81847,0,0,0,4,0,0,0
,释放吉安娜的碎片,4354,1759,81849,0,0,0,5,0,0,0
获取奖励，离开幻象。,获取奖励,4355,1733,83405,0,0,0,2,0,0,244
时候到了，攻击艾萨拉女王的权力宝座吧。,迎宾典礼,4356,1760,81865,0,0,0,0,0,0,0
永恒王宫的大厅深处，艾萨拉女王最忠实的下属想要阻止你们的入侵。,虔信深渊,4357,1761,81871,0,0,0,0,0,0,0
深渊中，有什么东西开始活动了，而艾萨拉女王的仪式也即将完成。,群星之环,4358,1762,81875,0,0,0,0,0,0,0
阻止阿玛赛特攻入起源大厅并激活起源协议。,耀辉之刃,4359,1763,82034,0,0,0,0,0,0,0
在血肉撕裂者的车间和吞噬者的巢穴调查并摧毁实验品。,失败的实验,4361,1764,82046,0,0,0,2,0,0,0
进入暗影烈焰穹顶。,暴力闯入,4362,1764,82052,0,0,0,0,0,0,0
与拉希奥交谈，开始仪式。,烈焰仪式,4364,1764,82250,0,0,0,8,0,0,0
摧毁奈法利安和奥妮克希亚的遗骸。,预防措施,4365,1764,82073,0,0,0,9,0,0,0
获取腐化的黑龙鳞片。,腐化鳞片,4366,1764,82058,0,0,0,10,0,0,0
在码头和加兹鲁维谈一谈。,强行霸占,4367,1765,82082,0,0,0,0,0,0,0
营救霍巴特·钩锤。,人质劫持,4368,1765,82084,0,0,0,1,0,0,0
装备X-52身体护甲。,全副武装！,4369,1765,82086,0,0,0,2,0,0,0
调查图书馆。,图书馆,4370,1764,82075,0,0,0,5,0,0,0
消灭图书馆的腐化实验品。,扭曲的实验品,4371,1764,82077,0,0,0,6,0,0,0
获取奖励，离开幻象。,获取奖励,4373,1731,83403,0,0,0,2,0,0,458
击败加里维克斯。,夺回城镇,4374,1765,82088,0,0,0,3,0,0,0
重新进入恩佐斯的幻象。,进入幻象,4375,1766,82097,0,0,0,0,0,0,0
击败造物主之阶的具象。,黑暗具象,4376,1766,82099,0,0,0,2,0,0,0
使用造物主之阶的升降梯查明异常。,最后的晋升,4377,1766,82105,0,0,0,3,0,0,0
击败起源熔炉的异常现象。,恢复供能,4378,1766,82103,0,0,0,4,0,0,0
摧毁阻止玩家进入下层走廊的屏障。,坠入疯狂,4380,1766,82119,0,0,0,1,0,0,0
