Description_lang,SourceText_lang,ID,CreatureID,SummonSpellID,IconFileDataID,PetTypeEnum,Flags,SourceTypeEnum,CardUIModelSceneID,LoadoutUIModelSceneID,CovenantID
金色靈狐很少會生下這種顏色的幼狐，在群體中這是不吉利的象徵。,|cFFFFD200寵物對戰：|r昇靈堡|n,2937,171703,0,3072467,7,26,4,6,7,0
這些有金色羽毛的生物不會生金蛋，金鵝才會生金蛋。,|cFFFFD200寶藏：|r昇靈堡,2938,171710,335076,605484,2,2,0,6,7,0
如果小心翼翼地編織它們的銀色羽毛，就能形成光滑如鏡的表面。,|cFFFFD200寵物對戰：|r昇靈堡|n,2939,171712,0,656318,2,26,4,6,7,0
新孵化的鶴鳥，羽毛一開始都是潔白無瑕。不過在幾週內，就會轉變成各種鮮豔色彩。,|cFFFFD200掉落：|r昇靈堡,2940,171714,335083,656319,2,2,0,6,7,0
以恰到好處的光線照射時，這隻小馬的鬃毛會呈現出如夢似幻的靛藍色。,|cFFFFD200誓盟特色：|r晉升之路|n|cFFFFD200誓盟：|r琪瑞安,2941,171716,335085,3387069,7,2,2,6,7,0
很少有東西能比年幼的天駒還可愛。,|cFFFFD200冒險：|r暗影之境,2942,171719,335087,3387070,7,2,0,6,7,0
幾乎無法在野外發現這些飛行生物的羽毛。如果羽毛剛好從它們身上脫落，羽毛會短暫發出強光，隨後消失不見。,|cFFFFD200寵物對戰：|r昇靈堡,2943,171666,0,3046536,2,26,4,6,7,0
戰鬥的快感和戰爭的束縛還留存在烏納的骸骨中。,|cFFFFD200掉落：|r烏納的手臂|n|cFFFFD200區域：|r瑪卓薩斯,2944,171954,335698,3386320,3,2,0,6,7,0
新生的骨牙從外觀上看不出有獠牙，但在幾週之後，他們的獠牙就會成長到和身形相稱的程度。,|cFFFFD200誓盟特色：|r餘燼宴會|n|cFFFFD200誓盟：|r汎希爾|n|n|cFFFFD200誓盟特色：|r女王的栽培園|n|cFFFFD200誓盟：|r暗夜妖精|n|n|cFFFFD200誓盟特色：|r晉升之路|n|cFFFFD200誓盟：|r琪瑞安|n|n|cFFFFD200誓盟特色：|r憎惡體工廠|n|cFFFFD200誓盟：|r死靈領主,2945,171982,335753,3456126,7,2,2,6,7,0
這些生物身上的獠牙與顱骨緊密相連，因此在衝鋒或用獠牙撞擊物體時，不會感到任何疼痛。,|cFFFFD200冒險：|r暗影之境,2946,171984,335755,3456127,7,2,0,6,7,0
發光織網者色彩鮮豔，吸引潛在的掠食者前來誤入牠們的蛛網。,|cFFFFD200寶藏：|r蛛眼寶箱|n|cFFFFD200區域：|r瑪卓薩斯,2947,171985,335762,2027857,7,2,0,6,7,0
瑪卓薩斯有太多強大和可怕的野獸，因此許多當地人被這種原生的巨大蜘蛛包圍時，依舊不為所動。,|cFFFFD200掉落：|r螯爪姊妹|n|cFFFFD200區域：|r瑪卓薩斯,2948,171986,335764,2027855,7,2,0,6,7,0
如果這種生物朝它的獵物噴吐毒液，技術上來說那算是毒液嗎？或是單純讓人覺得噁心而已？,|cFFFFD200寶藏：|r萌芽的物體|n|cFFFFD200區域：|r瑪卓薩斯,2949,171987,335765,2027951,7,2,0,6,7,0
你抓背的時候有個地方總是抓不到嗎？讓這個小傢伙幫你解決問題！,|cFFFFD200寵物對戰：|r瑪卓薩斯,2950,172130,0,3386321,3,26,4,6,7,0
聽那黏液裡的泡泡浮到表面破裂的聲音，太讓人滿足了。,|cFFFFD200寶藏：|r軟泥包覆箱|n|cFFFFD200區域：|r瑪卓薩斯,2952,172132,335966,3459800,5,2,0,6,7,0
害羞的梅爾文是瘟疫設計者瑪利雷斯最初的作品之一，但它太過膽小，根本達不到瘟疫家族對軟泥怪的要求。,|cFFFFD200掉落：|r致命的小傢伙|n|cFFFFD200區域：|r瑪卓薩斯,2953,172134,335969,3459798,5,2,0,6,7,0
一種以瑪卓薩斯的某些大型生物為宿主的寄生蟲，並且不斷吸血，直到成熟為止，不過這些宿主為什麼可以無動於衷？,|cFFFFD200誓盟特色：|r餘燼宴會|n|cFFFFD200誓盟：|r汎希爾|n|n|cFFFFD200誓盟特色：|r女王的栽培園|n|cFFFFD200誓盟：|r暗夜妖精|n|n|cFFFFD200誓盟特色：|r晉升之路|n|cFFFFD200誓盟：|r琪瑞安|n|n|cFFFFD200誓盟特色：|r憎惡體工廠|n|cFFFFD200誓盟：|r死靈領主,2954,172135,335972,3860397,4,2,2,6,7,0
儘管血蝨幼蟲軟綿綿的，不過成蟲全身上下都會長滿堅硬的甲殼。,|cFFFFD200掉落：|r『饗食者』嗜魔加斯|n|cFFFFD200區域：|r瑪卓薩斯,2955,172136,335974,3860399,4,2,0,6,7,0
瑪卓薩斯的各大家族會將失敗者丟進爬滿血蝨幼蟲的坑洞，讓他們生不如死。,|cFFFFD200掉落：|r『饗食者』嗜魔加斯|n|cFFFFD200區域：|r瑪卓薩斯,2956,172137,335977,3860398,4,2,0,6,7,0
瑪卓薩斯的部分捕獵者會把脊骨當成戰利品，而且其中的某些捕獵者連在收集脊骨的時候，都不會停下腳步。,|cFFFFD200掉落：|r斯肯納|n|cFFFFD200區域：|r瑪卓薩斯,2957,172139,335979,3386335,3,2,0,6,7,0
儘管肢體有所缺憾，它卻從未因此氣餒。,|cFFFFD200誓盟特色：|r憎惡體工廠|n|cFFFFD200誓盟：|r死靈領主,2958,172140,335980,3386334,3,2,2,6,7,0
在瑪卓薩斯，就算是最小的骨頭也不會浪費。,|cFFFFD200掉落：|r不死軍團補給品|n,2959,172148,336020,3511185,3,2,0,6,7,0
是軟泥讓骨頭不至於散掉，還是骨頭讓軟泥不至於塌掉？,|cFFFFD200掉落：|r油膩的無脊生物|n|cFFFFD200區域：|r瑪卓薩斯,2960,172149,336021,3459801,5,2,0,6,7,0
不建議您擁抱淤泥觸鬚。它留下的污漬是洗不掉的。,|cFFFFD200掉落：|r藩侯史特拉達瑪|n|cFFFFD200區域：|r瘟疫之臨|n|cFFFFD200難度：|r傳奇,2961,172150,336022,254105,5,2,0,6,7,0
要是你能打倒它們，就把它們縫起來！,|cFFFFD200商人：|r納爾空‧塔爾森|n|cFFFFD200區域：|r瑪卓薩斯|n|cFFFFD200陣營：|r不死軍團 - 崇敬|n|cFFFFD200花費：|r1765|TINTERFACE\MONEYFRAME\UI-GOLDICON.BLP:0|t,2962,172151,336024,3622122,3,2,2,6,7,0
附在穆達身上的靈魂生前是個嚴厲的統治者，而現在，他試圖統治有始以來最暴力的王國。,|cFFFFD200誓盟特色：|r憎惡體工廠|n|cFFFFD200誓盟：|r死靈領主,2963,172153,336030,3622121,3,2,2,6,7,0
那對有倒鉤的大顎會深深咬進任何東西的內部，造成劇烈疼痛。,|cFFFFD200掉落：|r飢餓巨毒蜂|n|cFFFFD200區域：|r瑪卓薩斯,2964,172155,336031,2027900,2,2,0,6,7,0
大多數蜘蛛都是以吸取獵物體液維生，不過啖血蛛不同，牠們是以吸食血液維生。,|cFFFFD200誓盟特色：|r餘燼宴會|n|cFFFFD200誓盟：|r汎希爾|n|n|cFFFFD200誓盟特色：|r女王的栽培園|n|cFFFFD200誓盟：|r暗夜妖精|n|n|cFFFFD200誓盟特色：|r晉升之路|n|cFFFFD200誓盟：|r琪瑞安|n|n|cFFFFD200誓盟特色：|r憎惡體工廠|n|cFFFFD200誓盟：|r死靈領主,2965,172284,336311,2027944,7,2,2,6,7,0
有時候，某些強大靈魂的罪孽實在太過深重，甚至足以活化其下面的岩石。,|cFFFFD200誓盟：|r汎希爾|n|cFFFFD200區域：|r瑞文崔斯,2966,172570,337031,3386971,6,16466,2,6,7,0
泥掘者是瑞文崔斯的汗水，甚至是淚水，他們的貢獻對於瑞文崔斯的運作不可或缺。,|cFFFFD200誓盟特色：|r餘燼宴會|n|cFFFFD200誓盟：|r汎希爾,2967,172854,337694,1505934,0,16466,1,6,7,0
,,2968,173133,0,1339043,8,33826,-1,6,7,0
,,2969,173216,0,3052547,2,32802,-1,6,7,0
,,2970,173215,0,667692,2,32802,-1,6,7,0
,,2971,173214,0,3155425,7,32802,-1,6,7,0
,,2972,173213,0,133936,8,32802,-1,6,7,0
,,2973,173212,0,3387070,7,32802,-1,6,7,0
,,2974,173211,0,3046536,2,32802,-1,6,7,0
,,2975,173206,0,3610503,9,32802,-1,6,7,0
,,2976,173205,0,132935,9,32802,-1,6,7,0
,,2977,173204,0,3582261,9,32802,-1,6,7,0
,,2978,173274,0,3622122,3,33826,-1,6,7,0
,,2979,173303,0,237541,6,33826,-1,6,7,0
,,2980,173258,0,2399287,0,32802,-1,6,7,0
,,2981,173259,0,237402,7,32802,-1,6,7,0
,,2982,173260,0,462337,2,32802,-1,6,7,0
,,2983,173264,0,3386334,3,32802,-1,6,7,0
,,2984,173265,0,3386320,3,32802,-1,6,7,0
,,2985,173266,0,133884,3,32802,-1,6,7,0
,,2986,173271,0,342917,3,32802,-1,6,7,0
,,2987,173272,0,1570765,2,32802,-1,6,7,0
,,2988,173273,0,2998183,3,32802,-1,6,7,0
,,2989,173320,0,134389,6,32802,-1,6,7,0
,,2990,173321,0,132182,2,32802,-1,6,7,0
,,2991,173322,0,538518,4,32802,-1,6,7,0
,,2992,173326,0,1623379,7,32802,-1,6,7,0
,,2993,173328,0,2027855,7,32802,-1,6,7,0
,,2994,173329,0,458967,0,32802,-1,6,7,0
,,2996,173332,0,132140,7,33826,-1,6,7,0
,,2998,173376,0,1096090,7,33826,-1,6,7,0
,,2999,173381,0,797544,7,33826,-1,6,7,0
,,3000,173373,0,3065166,4,32802,-1,6,7,0
,,3001,173374,0,1394966,7,32802,-1,6,7,0
,,3002,173375,0,3255390,2,32802,-1,6,7,0
,,3003,173378,0,3255388,2,32802,-1,6,7,0
,,3004,173379,0,2027900,2,32802,-1,6,7,0
,,3005,173380,0,132851,2,32802,-1,6,7,0
這些懼蝠是由石鑄宗匠專為收割者廷衛所打造，牠們與主人有很深的羈絆，生性凶猛好鬥。,|cFFFFD200掉落：|r收割者廷衛補給品|n,3006,173502,339590,3087792,2,2,0,6,7,0
這些蜘蛛最大的特徵就是顏色特殊的長腳，它們會跳起曼妙的舞蹈，威脅並混淆敵人。,|cFFFFD200寵物對戰：|r瑞文崔斯|n,3007,173506,0,2027952,7,26,4,6,7,0
不再遺失，而是視為改名。,|cFFFFD200掉落：|r遺失的羽毛筆|n|cFFFFD200區域：|r瑞文崔斯,3008,173508,339593,2103805,5,2,0,6,7,0
伯爵在納撒亞城領地中棲息，從沒想過自己會陷入永恆的石化沉眠。,|cFFFFD200寶藏：|r伯爵|n|cFFFFD200地區：|r瑞文崔斯|n|cFFFFD200花費：|r99|Hcurrency:1820|h|TInterface\ICONS\INV_Jewelcrafting_LivingRuby_01.blp:0|t|h,3009,173531,339668,3860423,2,2,0,6,7,0
在與罪殞城的新夥伴會合之後，其中幾隻年幼的懼蝠隨著雷納瑟的軍隊一起進入了淵喉。,|cFFFFD200掉落：|r昇靈堡淵喉進攻戰|n|cFFFFD200寶藏：|r罪殞城尖嘯者牢籠|n|cFFFFD200區域：|r淵喉,3010,173533,339670,3860424,2,2,0,6,7,0
棲息在罪殞城的蝠蝠有一天被第一場餘燼宴會的音樂聲喚醒。從此她從未錯過任何一場宴會。,|cFFFFD200商人：|r特梅爾|n|cFFFFD200區域：|r特梅爾|n|cFFFFD200陣營：|r餘燼宴會 - 崇敬|n|cFFFFD200誓盟：|r汎希爾|n|cFFFFD200花費：|r250|Hitem:163036|h|TInterface\ICONS\INV_Currency_PetBattle.BLP:0|t|h,3011,173535,339671,3860422,2,2,2,6,7,0
這隻小蝙蝠被他的主人遺棄在秘室中，它化成石像，沉睡了無數時光。,|cFFFFD200寶藏：|r修復的傳輸鏡子|n|cFFFFD200誓盟：|r汎希爾|n|cFFFFD200區域：|r瑞文崔斯,3012,173536,339674,3860425,2,2,0,6,7,0
這生物體內流動的，到底是什麼邪惡的物質？,|cFFFFD200寶藏： |r怪異的物體|n|cFFFFD200區域：|r瑪卓薩斯|n,3013,173534,339677,3860396,4,2,0,6,7,0
年幼的沼澤爬行者藏身於淤泥池附近的蘆葦中，耐心地等著獵物自己送上門。,|cFFFFD200寵物對戰：|r瑞文崔斯|n,3014,173555,0,3860419,6,26,4,6,7,0
這些沼澤爬行者以歿路沼澤廢棄物中的殘餘靈魄維生，如今變得極為衰弱，但牠們在飢餓的時候，卻會變得異常危險。,|cFFFFD200寵物對戰：|r瑞文崔斯|n,3015,173556,0,3732243,6,26,4,6,7,0
這個迷你樹被奇怪的孢子寄生了，但它好像不怎麼介意。,|cFFFFD200商人：|r寇提納留斯|n|cFFFFD200區域：|r亞登曠野|n|cFFFFD200陣營：|r瑪拉茲莫斯 - 友好|n|cFFFFD200誓盟：|r暗夜妖精|n|cFFFFD200花費：|r250|Hitem:163036|h|TInterface\ICONS\INV_Currency_PetBattle.BLP:0|t|h,3016,173585,339976,3731816,6,2,2,254,7,0
這些樹苗獲得足夠的靈魄時，成長速度異常驚人。等到完全成長後，樹葉會變得跟剃刀一樣鋒利。,|cFFFFD200商人：|r首席營業員沙洛恩|n|cFFFFD200區域：|r亞登曠野n|cFFFFD200誓盟：|r暗夜妖精|n|cFFFFD200花費：|r250|Hitem:163036|h|TInterface\ICONS\INV_Currency_PetBattle.BLP:0|t|h,3017,173586,339981,3747335,6,2,2,254,7,0
只要能找到這個樹種的小小殘片，並且重新種植，就能長回往日雄偉壯麗的樹種。,|cFFFFD200誓盟：|r暗夜妖精|n|cFFFFD200區域：|r亞登曠野,3018,173587,339982,3747336,6,16466,2,254,7,0
無論如何，絕對別叫它幫你提水桶。我們說好了不提暗影之境那個區域發生過的事。,|cFFFFD200商人：|r軸鼻|n|cFFFFD200區域：|r亞登曠野|n|cFFFFD200陣營：|r暗夜之廷 - 友好|n|cFFFFD200誓盟：|r暗夜妖精|n|cFFFFD200花費：|r250|Hitem:163036|h|TInterface\ICONS\INV_Currency_PetBattle.BLP:0|t|h,3019,173588,339983,3747337,6,2,2,254,7,0
這種寵物的空中活動力敏捷無比。牠一定能四腳著地，就算是用自製彈簧驅動飛鼠拋擲器發射的也一樣。,|cFFFFD200冒險：|r暗影之境,3020,173589,339997,3749003,4,2,0,6,7,0
亞登曠野種子中充沛的神祕能量會讓某些小動物發展出驚人的特殊能力。,|cFFFFD200寵物對戰：|r亞登曠野|n,3021,173590,0,3749004,4,26,4,6,7,0
這種小動物都能將大量的食物藏在臉頰中。這樣就能輕鬆在不同的藏匿食物地點之間運送食物。,|cFFFFD200寶藏：|r飛靈的寶物|n|cFFFFD200區域：|r亞登曠野,3022,173591,339999,3749005,4,2,0,6,7,0
沒有人敢肯定雷金納德是誰取的名字。唯一確定的就是他只承認這個名字。,|cFFFFD200商人：|r寇提納留斯|n|cFFFFD200區域：|r亞登曠野|n|cFFFFD200陣營：|r瑪拉茲莫斯 - 友好|n|cFFFFD200誓盟：|r暗夜妖精|n|cFFFFD200花費：|r250|Hitem:163036|h|TInterface\ICONS\INV_Currency_PetBattle.BLP:0|t|h,3023,173593,340002,3749006,4,2,2,6,7,0
天空或許灼燒了瑞文崔斯一部分的土地，不過頑強的生物仍可在這些嚴苛的環境中生存下來。,|cFFFFD200掉落：|r灰燼融合體|n|cFFFFD200誓盟特色：|r餘燼宴會|n|cFFFFD200誓盟：|r汎希爾|n|cFFFFD200區域：|r瑞文崔斯,3024,173842,340710,134389,6,2,0,6,7,0
沒人知道為什麼這些骸骨手都是左手。右手到底跑去哪了？,|cFFFFD200寶藏： |r骷髏手碎片|n|cFFFFD200區域：|r瑪卓薩斯,3025,173847,340717,3386322,3,2,0,6,7,0
托迦司是一座充滿永恆苦痛與折磨的高塔，正好是適合這些生物的完美環境。,|cFFFFD200掉落：|r托迦司|n,3026,173849,340721,3579945,4,2,0,6,7,0
很多人都在問這些生物是從哪裡來的，牠們又是怎麼來到淵喉的，然而那些研究牠們的人，就再也沒有回來過了。,|cFFFFD200掉落：|r托迦司|n|n,3027,173850,340722,3579948,4,2,0,6,7,0
如果一隻斷手在托迦司境內拍手，閻獄之主會聽見嗎？,|cFFFFD200掉落：|r托迦司|n|n,3028,173851,340723,3862168,3,2,0,6,7,0
活化這隻手的神秘力量看起來不太邪惡，至少目前是如此。,|cFFFFD200掉落：|r托迦司|n,3029,173988,341289,3862169,3,2,0,6,7,0
有時候，你發現的奇怪生物，最好還是留在托迦司深處的神秘罈子裡就好。,|cFFFFD200掉落：|r托迦司|n,3030,173989,341292,3453807,4,2,0,6,7,0
牠的牙齒鋒利無比，什麼東西都咬得爛。,|cFFFFD200掉落：|r托迦司|n,3032,173990,341293,3860392,4,2,0,6,7,0
這些托迦司的守護者一直都在留意可疑的風吹草動。,|cFFFFD200掉落：|r托迦司|n|n,3033,173991,341295,3729719,5,2,0,6,7,0
如果你覺得好像有黑影正如影隨形地跟著你，通常是因為它真的在跟蹤你。,|cFFFFD200掉落：|r托迦司|n,3034,173992,341298,237569,3,2,0,6,7,0
戳小果姆一下會發出療癒的咕啾聲。但是最好不要戳太多下。,|cFFFFD200掉落：|r果姆巨獸|n|cFFFFD200區域：|r亞登曠野,3035,173993,341301,3065167,4,2,0,6,7,0
雷莫尼亞一直暴露於不計其數的邪惡與罪孽之中，無所不用其極地汲取能量，助長其慾望。,|cFFFFD200掉落：|r戴納瑟斯王|n|cFFFFD200區域：|r納撒亞城,3036,173994,341302,3610989,5,82,0,363,364,0
凝視這些生物時，你會打從心底產生一種極度空虛的感覺，接著被恐懼感所取代。,|cFFFFD200掉落：|r『折磨者』伊特納斯|n|cFFFFD200區域：|r淵喉,3037,174081,341492,651083,6,2,0,6,7,0
這種生物背上有獨一無二的印記，很容易就能從淵喉的恐怖生物中一眼辨認出來。,|cFFFFD200掉落：|r淵喉|n,3038,174082,341493,3579949,4,2,0,6,7,0
這種可怕的生物會一直從身上掉落皮屑，形成一道軌跡，而且味道異常難聞。,|cFFFFD200掉落：|r淵喉|n,3039,174083,341494,3860390,4,2,0,6,7,0
鋒利無比的爪子可輕鬆撕開任何事物，因此可以充當臨時開罐器。,|cFFFFD200掉落：|r『拷問者』山格羅|n|cFFFFD200區域：|r淵喉,3040,174084,341495,3862170,3,2,0,6,7,0
這些從不眨眼，無時無刻都在凝視的眼睛，究竟在托迦司見到了多少恐怖的景象？,|cFFFFD200成就：|r扭曲迴廊：第2區|n|cFFFFD200類別：|r托迦司,3041,174085,341497,3729814,5,82,5,6,7,0
從侍者身上拔下一根羽毛是件罪大惡極的事，足以被流放到瑞文崔斯。,|cFFFFD200誓盟：|r琪瑞安|n|cFFFFD200區域：|r昇靈堡,3042,174087,341515,3731724,0,16466,2,6,7,0
這隻貓科動物不是毛茸茸的，卻是黏糊糊的，不過可愛度依然爆表。,|cFFFFD200誓盟：|r死靈領主|n|cFFFFD200區域：|r瑪卓薩斯|n,3043,174088,341516,3732497,5,16466,2,6,7,0
小時候，牠們有一張可愛的臉，以及俏皮的小觸角。長大後，牠們則長出鋒利無比的螫，化身無堅不摧的進食機器。建議謹慎以對。,|cFFFFD200掉落：|r崔朵瓦|n|cFFFFD200區域：|r特那希迷霧|n|cFFFFD200難度：|r傳奇,3044,174089,341519,3065164,4,2,0,6,7,0
如果你一直盯著它看，這隻軟泥怪似乎會變色，然後，突然間，它似乎回瞪你一眼。也許該休息一下了。,|cFFFFD200寶藏：|r瘟疫亡者寶箱|n|cFFFFD200區域：|r瑪卓薩斯,3045,174125,341635,1500910,5,2050,0,6,7,0
雖然外表是羸弱的不死生物，不過魂屍其實身形靈活，來去如風。,|cFFFFD200世界事件：|r《暗影之境》天譴軍團入侵|n|cFFFFD200花費：|r20|Hcurrency:1754|h|TInterface\ICONS\Achievement_Reputation_ArgentCrusader.blp:0|t|h,3046,174181,341825,336781,3,2,2,6,7,0
你脊蟲上身了！,|cFFFFD200寶藏：|r脊蟲|n|cFFFFD200區域：|r瑪卓薩斯,3047,174677,343161,3386337,3,2,0,6,7,0
它們的皮膚通常是純白色，不過卻會因食物而有所變化，根據消化的器官產生美麗無比的色斑。,|cFFFFD200寵物對戰：|r瑪卓薩斯,3049,175021,0,2141734,4,26,4,6,7,0
傳說如果你夢到淒涼爬行蛛，你就注定會跟牠來場生死搏鬥。,|cFFFFD200寵物對戰：|r瑪卓薩斯,3050,175022,0,2027947,7,26,4,6,7,0
這些黏糊糊的生物在爬牆的時候，會發出超級奇怪的吸吮聲。基於顯而易見的理由，這件事在瑪卓薩斯無人不知，無人不曉。,|cFFFFD200寵物對戰：|r瑪卓薩斯,3051,175023,0,3459799,5,26,4,6,7,0
不管這些生物飛到哪裡，都會降下劇毒孢子， 吸引許多小動物自投羅網、變成恐怖的佳餚。,|cFFFFD200寵物對戰：|r瑪卓薩斯,3052,175024,0,1570759,2,26,4,6,7,0
在虛空之翼岩架孵化的奇異幼龍，似乎得到影月谷的弦月能量祝福。,|cFFFFD200暴雪30週年紀念|r ,3053,175203,344755,3846213,1,82,7,6,7,0
從文獻管理員費恩的早年時期就一直是他的好朋友，不過賈尼拉覺得費恩越來越黏這支筆，決定讓他們分道揚鑣。,|cFFFFD200商人：|r文獻管理員賈尼拉|n|cFFFFD200區域：|r瑞文崔斯|n|cFFFFD200陣營：|r誓復者 - 崇拜|n|cFFFFD200花費：|r1000|Hcurrency:1816|h|TInterface\ICONS\6BF_Blackrock_Nova.BLP:0|t|h,3054,175220,344792,2103808,5,2,2,6,7,0
如果侍者想要在侍者這個群體中出人頭地，就必須讓羽毛保持蓬鬆，送出數以噸計的果汁，並且一直叫個不停。,|cFFFFD200商人：|r澤雷司寇斯|n|cFFFFD200誓盟：|r琪瑞安|n|cFFFFD200區域：|r昇靈堡,3061,175561,345740,3731728,0,2,2,6,7,0
傳說中，侍者之所以誕生，是為了幫助昇靈堡的居民履行他們永恆的職責。他們似乎欣然接受。,|cFFFFD200掉落：|r昇靈堡|n|cFFFFD200誓盟：|r琪瑞安,3062,175560,345741,3731723,0,2,0,6,7,0
拉里翁是非常驕傲的生物，任何踏入其地盤的生物都會被視為入侵者。,|cFFFFD200掉落：|r拉里翁騎士歐司提斯|n|cFFFFD200區域：|r昇靈堡,3063,175562,345742,3860694,2,2,0,6,7,0
成熟之後，與志士一起長大的拉里翁永遠不會離開主人身邊。,|cFFFFD200掉落：|r晉升者補給品|n,3064,175564,345744,3860696,2,2,0,6,7,0
昇靈堡經常將年幼的拉里翁賜予志士，作為對同情心和領導能力的初步考核。,|cFFFFD200掉落：|r勇氣|n|cFFFFD200區域：|r昇靈堡|n,3065,175563,345743,3860695,2,2,0,6,7,0
跟其他的貓一樣，露西被送到了瑞文崔斯，然後她不知道為什麼逃走了。當地泥掘者將此歸咎於「誰叫她是一隻貓」。,|cFFFFD200掉落：|r骯髒的閃爍物體|n,3066,175715,346192,611425,3,2,0,41,7,0
木魈是住在亞登曠野的狡詐敵人，時常欺負暗夜妖精。而這個傢伙決定對你使出終極搞破壞大法，就是跟你一起行動。,|cFFFFD200成就：|r家庭驅魔師|n|cFFFFD200類別：|r寵物對戰,3067,175756,346236,3536179,0,82,5,6,7,0
,,3068,175777,0,657918,8,1072,-1,6,7,0
,,3070,175778,0,3072466,7,1072,-1,6,7,0
,,3071,175779,0,3084143,4,1072,-1,6,7,0
,,3072,175780,0,2103813,1,1072,-1,6,7,0
,,3073,175781,0,3732243,6,1072,-1,6,7,0
,,3074,175782,0,3860424,2,1072,-1,6,7,0
,,3075,175783,0,3731723,0,1072,-1,6,7,0
,,3076,175784,0,3601538,5,1072,-1,6,7,0
,,3077,175785,0,3070805,9,1072,-1,6,7,0
,,3078,175786,0,3622122,3,1072,-1,6,7,0
木魈的忠誠就有如四季更迭一樣變幻莫測。,|cFFFFD200成就：|r至死不休|n|cFFFFD200類別：|r寵物對戰,3079,175787,346260,3536177,0,82,5,6,7,0
在亞登曠野青翠的林地中長大，這些幼狐充滿重生的精華。,|cFFFFD200寵物對戰：|r亞登曠野|n,3080,176019,0,3072464,7,26,4,6,7,0
這些幼蟲會吃掉各種蘊含靈魄的東西，牠們不挑食。,|cFFFFD200寵物對戰：|r亞登曠野,3081,176020,0,3065166,4,26,4,6,7,0
這飛蛾的翅膀閃著璀璨光芒，猶如亞登曠野夜空上的美麗星光。,|cFFFFD200寵物對戰：|r亞登曠野,3082,176021,0,3255390,2,26,4,6,7,0
這寵物的食量這麼大，吃下去的東西到底都跑去哪裡了？瑪卓薩斯的死靈法師解剖了許多這種生物，仍然找不到答案。,|cFFFFD200寵物對戰：|r瑪卓薩斯,3083,176024,0,3731581,2,26,4,6,7,0
,,3089,176657,0,132263,9,48,-1,6,7,0
,,3090,176659,0,2490921,2,48,-1,6,7,0
,,3091,176658,0,1600298,7,48,-1,6,7,0
史奎寶被工程師設計永遠不會離開你身邊。,|cFFFFD200掉落：|r咕嚕摩袋子|n,3092,176662,348561,2490921,9,2,0,6,7,0
這類小蟲在帷幕市集相當受歡迎。寶石瑕疵不多的小蟲能賣到相當誇張的價錢。,|cFFFFD200商人：|r飼養員塔赫特|n|cFFFFD200區域：|r奧睿博司|n|cFFFFD200花費：|r10000|Hitem:163036|h|TInterface\ICONS\INV_Currency_PetBattle.BLP:0|t|h,3097,178216,351636,3856132,7,2,2,6,7,0
戰場上滿是小縫合散落的碎塊，全都能任意替換，也很容易重新組合。,|cFFFFD200掉落：|r瑪卓薩斯淵喉進攻戰|n,3098,179008,353206,3622121,3,2,0,6,7,0
灌魔翼靈蛇可以作為可攜式靈魄電池使用，但是這些翼靈蛇必須先經過訓練，以免它們一看到戰鬥爆發就逃之夭夭。,|cFFFFD200掉落：|r亞登曠野淵喉進攻戰|n|cFFFFD200寶藏：|r翼靈蛇牢籠|n|cFFFFD200區域：|r淵喉|n,3099,179025,353230,3046536,2,2,0,6,7,0
巨龍可以按照時間特性分為很多不同的種類，例如：永恆、時佚甚至是無限。,|cFFFFD200商人：|r歷史學家瑪迪|n|cFFFFD200區域：|r塔納利斯|n|cFFFFD200花費：|r200|Hcurrency:1166|h|TInterface\ICONS\PVECurrency-Justice.blp:0|t|h,3100,179125,353442,2892271,9,2,2,6,7,0
狡狐偷偷跟著大夥兒一起來到了淵喉。他並不感到害怕，他只是想要在你的背包裡面多待一會兒。,|cFFFFD200成就：|r狡猾的狐狸|n|cFFFFD200類別：|r收集,3101,179083,353450,3072461,7,2,5,6,7,0
只要提供大量的飼料，年幼的靈蜱就會迅速生長。建議每年不要餵養超過一個普通靈魂量的靈魂，以免靈蜱變得具有攻擊性。,|cFFFFD200寵物對戰：|r科西亞,3102,179131,0,3155460,2,26,4,6,7,0
翼靈蛇的璀璨鱗片會倒映出昇靈堡燦爛的天空。,|cFFFFD200掉落：|r晉升者戰爭寶箱|n|cFFFFD200區域：|r淵喉,3103,179132,353451,3046536,2,2,0,6,7,0
如果寶石小蟲死掉，它們身上的寶石就會迅速衰變。富有的仲介者會眷養健康狀況良好的小蟲，把它們當作珍貴的寵物飼養。,|cFFFFD200商人：|r飼養員塔赫特|n|cFFFFD200區域：|r奧睿博司|n|cFFFFD200花費：|r1|Hitem:36812|h|TInterface\ICONS\INV_Misc_Gear_01.blp:0|t|h 1|Hitem:62072|h|TInterface\ICONS\INV_Staff_11.blp:0|t|h 1|Hitem:67410|h|TInterface\ICONS\INV_Stone_13.blp:0|t|h,3104,179137,353456,3856131,7,2,2,6,7,0
這些寶石小蟲是仲介者在一個未知世界所找到的生物，它們身上的寶石閃耀動人，導致那次遠征隊的成員很快就為了那些寶石爭吵了起來。,|cFFFFD200商人：|r飼養員塔赫特|n|cFFFFD200區域：|r奧睿博司|n|cFFFFD200花費：|r1|Hitem:3300|h|TInterface\ICONS\INV_Gauntlets_02.blp:0|t|h 1|Hitem:3670|h|TInterface\ICONS\INV_Misc_Bone_01.blp:0|t|h 1|Hitem:6150|h|TInterface\ICONS\INV_Misc_Bandage_06.blp:0|t|h,3105,179138,353457,3856130,7,2,2,6,7,0
寶石小蟲在自然界沒有天敵，它們會壯大身上的寶石來求偶。,|cFFFFD200商人：|r飼養員塔赫特|n|cFFFFD200區域：|r奧睿博司|n|cFFFFD200花費：|r1|Hitem:11406|h|TInterface\ICONS\INV_Misc_Pelt_Bear_Ruin_02.blp:0|t|h 1|Hitem:11944|h|TInterface\ICONS\INV_Boots_06.blp:0|t|h 1|Hitem:25402|h|TInterface\ICONS\INV_Hammer_16.blp:0|t|h,3106,179139,353458,3856129,7,2,2,6,7,0
人們常常會在艾澤拉斯的各個地方發現新品種的魚人，這是因為魚人天生就喜歡侵略其他物種的生存空間，而且幾乎什麼都吃。,|cFFFFD200任務：|r戈嚕與盜匪|n|cFFFFD200區域：|r艾薩拉之眼,3107,179140,353460,3987165,0,82,1,6,7,0
喵爾金會獵殺出沒在帷幕市集的外來斯克鼠，但同時又不會把斯克鼠趕盡殺絕，避免招來兔死狗烹的命運。,|cFFFFD200寵物對戰：|r『帷幕市集』塔札維許,3108,179164,0,3742945,7,26,4,6,7,0
